Title-题名,Author-作者,Organ-单位,Source-文献来源,Keyword-关键词,Summary-摘要,PubTime-发表时间
“人工智能+金融监管”:试论金融科技监管的转型与重塑,周温涛;,同济大学法学院;,《上海法学研究》集刊（2019年第9卷 总第9卷）,人工智能;;金融科技;;监管科技;;机器学习;;技术治理,"金融科技的""颠覆性创新""推动了新时代金融业的转型升级,也预示着传统金融监管将迈向新的范式。技术驱动的金融创新容易引发技术风险、信息风险与合规风险。通过人工智能为金融科技监管赋能,可以打造技术驱动型监管科技,实现金融监管的转型与重塑。借鉴互联网金融监管和证券监管领域的实践经验,不难发现,人工智能在识别和应对系统性金融风险中更具优势。因此,应当探索技术治理与法律规制相结合的、人工智能技术驱动型的金融科技监管新范式,实现法律与技术的优势互补,从而实现金融科技的有效监管。",2019-08-30
金融科技发展的监管路径――以区块链技术为视角的分析,曾发亮;,华中师范大学;,特区经济,金融科技;;监管理念;;制度构建,"金融科技的出现,深刻的改变了金融业的运营模式,进一步推动了金融业的发展。但是,金融科技带来的消费者信息保护及救济问题、市场的波动问题、监管乏力问题,需要我们进行深入研究和解决。面对新兴的金融科技,我们应当秉持包容、科技、穿透式监管的理念,既鼓励金融创新,同时进行动态监管,避免发生系统性金融风险。同时应用沙箱监管,对金融科技的创新进行可行性检验,确保其安全性。将区块链技术的去中心化、不可篡改性和自治性的特点融入到对金融科技的监管之中,促进金融科技的健康发展。",2019-08-25
以科技赋能普惠金融――访联动优势科技有限公司CEO 李贲,戈晶晶;,中国信息界,中国信息界,联动优势;普惠金融;移动支付;区块链技术;CEO;,"近年来,随着科技的不断进步,人工智能、大数据、云计算等新一代信息技术逐步渗透到各个行业。其中,在金融领域的发展尤为迅速,特别是在移动支付方面,我国移动支付已经居于全球领先水平,普及率更是位于世界首位。随着金融科技的不断发展,金融机构和科技领军企业纷纷涉足,资本市场竞相追捧,政府部门重视程度也随之不断提高,对于金融科技的监管逐步加强。为了更好地了解我国金融科技的实际发展情况,理解国家相关政策趋势,《中国信息界》记者专门采访了联动优势科技有限公司(以",2019-08-25
保险科技赋能中国险企转型 推动业务发展与管理革新,忻怡;,安永(中国)企业咨询有限公司;,上海保险,保费收入;寿险公司;产险公司;健康险;保险消费者;人工智能;保险业;发展与管理;,"如今,国内外都在谈保险转型。很多咨询公司做了研究,通过研究调研来看金融科技对金融业净资产收益率的提升是多少、对社会价值的贡献又是多少。安永在2019年进行了全球金融科技采纳指数的调研,采访了27个市场的2.7万多名消费者。结果显示,在五个主要金融科技领域,即转账和支付、储蓄和投资、预算和理财、保险、借贷,保险领域的金融科技采纳率从2015年的8%提升到2019年的48%。消费者对金融科技的",2019-08-20
大数据时代金融科技风险管控研究,方秀丽;,浙江金融职业学院;,全国流通经济,金融科技;;大数据;;风险管控,"随着我国计算机与互联网科技的不断发展,大数据时代日益深入人们的日常生活。近年来,人工智能技术以及云计算技术逐渐成熟并被广泛运用到各行各业中,其中,在金融领域,人工智能与云计算催生了金融科技产业,这对于传统金融行业而言是极大的变革优势。然而,大数据背景下的金融科技产业在发展过程中也暴露出各种问题,包括数据安全、监管以及传播速度、规则等在内的风险漏洞频发,给金融行业的健康发展造成威胁。本文以大数据时代为背景,对金融科技的基本内涵、主要风险以及管控措施展开探索,以期为我国金融产业的可持续发展提供参考依据。",2019-08-18
广东省发展金融科技的问题及对策研究,王陶冶;李利;尹冰毅;,广东省科学技术情报研究所;碧桂园控股有限公司;,广东科技,金融科技;人工智能技术;地方金融风险;金融科技创新;广东省;问题及对策研究;,"0引言金融科技是一种创新的技术与模式,可以给金融服务业带来改变1,包括人工智能技术、大数据技术、云技术、移动技术、生物识别技术等等,这些前沿技术可以极大地提升金融服务的质量、效率以及抵抗风险的能力。现今世界正处于第四次金融浪潮,现在的时代是金融兴国的时代。近五年来,全球金融科技公司数量翻了近三倍,融资总额翻了近七倍。2019年",2019-08-15
金融科技助力实体经济高质量发展的作用机理研究,周雷;周铃;毛丹玲;,苏州市职业大学商学院;中国技术经济学会金融科技专业委员会;东南大学经济管理学院;,浙江金融,金融科技;;实体经济;;高质量发展;;数字普惠金融,"基于新时代实体经济发展过程中的新金融需求、普惠金融需求和金融基础设施需求,详细探讨金融科技创新赋能实体经济高质量发展的作用机理。首先,金融科技通过应用人工智能、区块链、大数据等技术,能够提高投资效率,满足新兴企业成长和传统产业数字化转型中的新金融需求,助力培育经济发展新动能。其次,金融科技创新能够引领数字普惠金融发展,满足民营企业、小微企业、低收入群体、消费升级等实体经济重点领域和薄弱环节的普惠金融需求,促进经济均衡发展。此外,金融科技龙头企业输出金融科技基础设施,还有助于国内企业""走出去""和满足""一带一路""建设中的金融需求,实现互利共赢,推动实体经济高质量发展。",2019-08-15
金融科技赋能下移动支付走出去的风险探究,龚雪俊;,中央财经大学商学院;,现代商贸工业,金融科技;;移动支付;;风险控制,"如今,我国移动支付产业在金融科技的赋能下,得到全面成长和迅速发展。当前广泛使用到移动支付领域的金融科技有大数据、云计算、区块链和人工智能。在这些金融科技的赋能下,我国移动支付产业蒸蒸日上,并走向世界。通过识别金融科技赋能下中国移动支付企业在走出去的过程中可能遇到的风险、探索出具有特殊意义的风险种类,为中方移动支付企业在开辟新市场或运营已有业务上规避或降低风险提供参考。",2019-08-15
智能供应链金融助力普惠金融服务研究,王硕;,阳光金科集团;,农村金融研究,供应链金融;;区块链;;金融科技,"当前,以人工智能、区块链、云计算和大数据为代表的金融科技正与传统供应链金融深度融合,形成新一代的智能供应链金融平台。新一代平台具有智能多方连接、链条企业互信、多级信用穿透、生态风控闭环等特点,有望通过将核心企业信用多级传导和资金闭环运作方式,在风险相对可控的前提下,批量服务中小企业融资。",2019-08-15
金融科技下商业银行多态势发展研究,韦颜秋;吴良君;,天津商业大学经济学院;,环渤海经济t望,多态势银行;;智慧金融;;智能风控;;区块链,"在""智慧金融""的大背景下,金融科技的迅猛发展使得传统商业银行弊端愈发显露,商业银行必须依据现有条件,在金融科技指引下,打造以互联网、区块链、大数据和人工智能技术为核心的轻型态、数字态、信息态与智慧态的""多态势银行""。需要重塑银行文化价值观、稳健分布推进API产品服务开放进程、智能风控建设提升风险管理水平以及对金融科技与商业银行的监管进行适应性调整等。",2019-08-15
“四支柱”人才战略促金融科技创新,刘光仿;,中国农业银行研发中心;,企业管理,Bank4.0;;金融科技;;新常态;;人力资源“三支柱”理论;;“四支柱”人才战略,"通过积分制等方式实施常态化晋级、晋升,通过丰富的职位种类和多级的晋升模式,满足人才多样化发展需求。BANK4.0时代,金融科技和技术创新已成为驱动商业银行转型发展的核心动力,特别是近年来,随着大数据、云计算、区块链、人工智能等新业态、新技术的兴起,互联网金融",2019-08-14
金融科技对金融业网络安全的影响及监管对策,金泽芬;,中国人民银行银川中心支行;,金融科技时代,金融科技;;网络安全;;开放银行;;Bigtech,"随着金融科技的快速发展,金融业网络安全问题逐渐显现。本文根据当前金融科技的发展情况,系统地分析了金融科技对金融业网络安全的影响,并在此基础上借鉴国外监管经验,提出了针对性的政策建议,如加强数据安全防护与隐私保护、加大外包商的管理力度、注重算法的合规监管等。",2019-08-10
华福证券总经理陈键金 融科技能为证券业带来什么?,李慧;苏宝茵;,科技与金融,科技与金融,智能投顾;量化投资;投资者;总经理;,"植根福建,华福证券有限责任公司(下称""华福证券"")近年来发展势头强劲。这家以""服务金融业、服务实体经济""为方向的券商传承了福建人的顽强拼劲,近年在全国实现了快速扩张,同时也以规范管理、稳健投资著称,连续7年被中国证券监督管理委员会(下称""证监会"")评定为A类A级券商。随着大数据、云计算、人工智能、区块链等技术发展,传统证券行业迎来了新变革。华福证券总经理、党委书记陈键结合公司自身实践,详细介绍了金融科技在证券业应用的现状、风险以及未来展望。",2019-08-09
金交会黑科技范十足 无感加油最吸睛,李慧;,金交会;,科技与金融,中国农业银行;参展观众;人工智能;科技体验;,"5G通信即时连线全球、足不出车完成加油所有流程、智能健康机器人现场""号脉""……在第八届中国(广州)国际金融交易・博览会(下称""金交会"")上,金融黑科技齐齐登场,处处散发着智慧金融的魅力。据悉,本届金交会设立5大展馆,14个主题展区,集中展示了广东、广州的金融创新成果,""让世界在这",2019-08-09
"App成转型主阵地,招商银行践行“先App后信用卡”",彭惠新;,中国信用卡,中国信用卡,信用卡服务;信用卡中心;银行信用卡;App;主阵地;,"""得用户者得天下""。移动互联时代,App肩负着推动银行业务转型的重要使命,是银行数字化转型过程中重要的竞技场,也是银行决胜未来的关键一环。招商银行信用卡作为业内率先进行移动转型的信用卡品牌,近年来在移动互联、大数据、人工智能等金融科技发展浪潮下,提出""先App后信用卡""""从客户思维向用户思维转变"",成效有目共睹。",2019-08-07
人工智能时代我国商业银行金融科技业务风险管理,张丽萍;颜配强;刘波;,兴业银行北京分行企业金融集团;,银行家,我国商业银行;内部控制;业务风险;金融科技风险;人工智能时代;信用风险评估;云计算环境;,"人工智能时代的到来使得数字经济发展迅速,商业银行等金融机构在数字经济不断发展中对已有的业务进行创新,开发出以云计算、区块链以及供应链金融等多种电子信息平台和数据后台支持的金融科技业务。金融科技的普遍化和分类化既对传统的金融业务产生了一定的冲击,同时也对商业银行经营金融科技业务提出了更高的要求。金融科技的用户渗透率之间增多(见",2019-08-05
金融科技与金融机构风险管理,俞勇;,广东(粤财)投资控股有限公司;,上海金融,金融科技;;风险管理;;人工智能;;区块链;;云计算;;大数据;;合规风险;;技术风险;;宏观监管;;中观监管;;微观监管,"金融科技广泛地应用于金融业,引导金融科技在金融机构风险管理中的应用,是健全金融监管体系、守住不发生系统性金融风险底线的重要抓手。经济发展、金融业发展、金融监管是平衡金融科技与金融机构风险管理关系的三大现实要求;科技创新是金融创新的基础和重要途径,科技与金融的融合是金融科技的基础和趋势。以人工智能、区块链、云计算、大数据等基础技术为主的金融科技正助力于金融机构的风险管理,由此带来的合规风险、技术风险、操作风险、信息安全风险等受到广泛关注;应将金融科技纳入金融监管,从监管体制、监管政策、监管科技等方面加强金融科技的宏观监管,从行业自律主体、规范章程、功能性监管、底层技术的研发与成果转化等方面加强金融科技的中观监管,从风险治理架构、风险管理体系、监测机制、识别机制、测量机制、预警机制、处置机制等方面加强金融科技的微观监管。",2019-07-31
金融科技如何助力农商银行内控发展,班风宝;朱之伟;,济南农村商业银行股份有限公司;中国人民银行济南分行营业管理部;,金融发展研究,农商银行;合规管理;金融科技;银行内控管理;,"目前,大数据、人工智能、区块链等新技术层出不穷,并在金融业得到广泛应用,推动金融机构向更复杂的方向发展。如何发挥科技在合规管理方面的价值,切实提高银行核心竞争力,是每一个银行业金融机构需要深入思考并实践的课题。一、农商银行内控管理现状国内农商银行的合规风险及其管理相对传统,更多的是依赖对员工的培训、考试、检查、审计、各",2019-07-25
人工智能背景下金融管理专业的转型,郑红梅;方浩文;,深圳职业技术学院;,深圳职业技术学院学报,金融科技;;转型;;课程重构;;人工智能,"分析了金融科技的现状、颠覆性特点及对金融业带来的人才变革,在此基础上提出了金融管理专业转型的定位、目标,重点论述专业课程体系改革与课程重构以及专业教学团队的塑造。本文认为,金融管理专业转型呈现三大特色:一是与世界一流的企业建设校企合作平台;二是聘世界一流的金融大师引领教师团队;三是用最前沿的区块链技术进行教学改革。",2019-07-20
2019中国智能风控企业50强,看虎;,互联网周刊,互联网周刊,风控系统;数联铭品;区块链技术;金融科技创新;大数据;城市商业银行;互联网金融;金融信息服务;征信服务;,"互联网金融概念的出现源于新兴技术的涌入,金融业务与互联网和通信技术的融合之下,互联网金融出现。走过最初的萌芽和成长阶段,今天中国的互联网金融市场正处于市场体量不断膨胀的爆发期。但是,金融科技创新与银行数字化转型不会改变金融风险的实质,金融的核心是风控,互联网金融的核心是大数据、人工智能、云服务与物联网等融合而成的智",2019-07-20
基于个人投资者视角探究中国智能投顾的发展困境,祝静远;,安徽财经大学金融学院;,营销界,智能投顾;;金融科技;;个人投资者;;发展困境,"在人工智能背景下,智能投顾作为金融科技的重要产物,凭借其技术优势和成本优势成为普惠金融政策落实的路径之一。作为金融市场上的新兴产物,智能投顾在中国的推广遇上难题。从个人投资者角度出发,分析得到推广难题的成因有两大类:一是业务模式属性模糊,牌照问题阻碍业务推广;二是信息不对称和的存在,进一步阻碍市场发展。最后,提出从制度、平台以及投资者三方入手,共同解决业务推广难题,帮助智能投顾走出发展困境。",2019-07-19
英国央行金融科技进展述评,边鹏;,中国建设银行研究院;,信息通信技术与政策,金融科技;;英国央行;;人工智能,"通过梳理英格兰银行副行长Dave Ramsden在全球金融创新峰会上关于""拥抱金融科技""的主题演讲,对比分析了英、美、中和国际清算银行在相关领域的政策取向,从而得出了对我国制定金融科技发展规划有借鉴作用的政策启示。",2019-07-15
黑科技 炫酷达沃斯,张娜娜;,中国金融家,中国金融家,沃斯;,"盛夏时节的北方明珠大连,盛装迎接1800余名嘉宾集聚2019年新领军者年会(夏季达沃斯)。参会者围绕""领导力4.0:全球化新时代的成功之道""这一主题,就金融科技、人工智能、精准医疗等问题展开研讨。在本届夏季达沃斯上,除了源源不断产生的智慧火花,未来医院、数字化模拟、生物识别镜、5G智能沙箱等各种炫目的体验项目也令人脑洞大开。",2019-07-15
探讨金融科技对我国信息产业的影响,杨鸿瑞;,中央财经大学;,中国产经,金融科技;;信息产业;;经济增长;;互联网金融,"信息产业是依靠新的信息技术,制造和提供信息产品、信息服务的生产活动的组合。金融科技则是依靠大数据、区块链、云计算、人工智能等新兴前沿技术,对金融市场以及金融服务业务提供的新业务模式、新技术应用以及新产品、流程、服务等。本文较系统地介绍了信息产业发展的背景,分析了信息产业的行业特征,指出了金融科技对我国信息产业的影响,对金融科技与信息产业的进一步渗透与融合具有一定的指导意义。",2019-07-15
建行揭开“5G+智能银行”面纱,董静;,中国金融家,中国金融家,智能银行;,"好看、好用、好玩的5G+智能银行来了。日前,建设银行首批三家""5G+智能银行""落户北京,揭开了5G+智能银行的神秘面纱。这是建行继2013年推出全国首家智慧银行后,基于自身""新一代""核心系统,借助金融科技战略,融合5G、物联网、人工智能等新技术,将金融、社交、生活等场景相连接,打造的高效、便捷新型网点模式。智慧柜员机、金融太空舱、智能家",2019-07-15
金融科技对支付市场的促进及银行创新实现路径研究,汪宇涛;,湖南农业大学经济学院;,中小企业管理与科技(中旬刊),金融科技;;支付市场;;实现路径,"金融作为现代经济的核心,与科技的结合程度不断加深。随着大数据、人工智能、区块链等新技术越来越多的在金融科技领域中应用,银行传统的业务形态正在发生剧变,金融科技的发展正在重塑银行业态。目前,金融科技在我国处于起步阶段,随着其带来的业务模式创新与解决方案不断出现,为支付体系的发展注入了新的动力,同时也给支付管理带来了一些挑战。",2019-07-15
资产管理行业的金融科技应用之路,袁吉伟;,光大兴陇信托有限责任公司;,中国外汇,智能投顾;数字化转型;金融科技;全面风险管理体系;投资者;科技应用;投资顾问;人工智能技术;,"资产管理机构正在借助金融科技实现数字化转型,以提高自身运营效率,提升客户服务能力,创造新的业务模式,实现高质量发展。金融科技指通过技术手段推动金融创新,形成对金融市场、机构及金融服务具有重大影响的业务模式、技术应用以及流程和产品。以互联网、大数据、云计算、智能化、区块链等为代表的金融科技技术已逐步运用到金融行业中,在帮助传统金融行业增加收入、降低成本、提升效率的同时,也",2019-07-15
金融科技助力个人金融,苏筱芮;,麻袋研究院;,中国外汇,智能投顾;金融科技;便捷性;个人金融;区块链技术;,"随着金融科技的深化发展,越来越多的C端用户亦能体会到金融科技在个人金融领域的便捷性。近年来,金融科技(Fin Tech)通过大数据、人工智能、区块链等技术的运用,提升了金融业务活动的科技含量,助力金融业务高效、高质量发展。尽管金融科技的运用和学术研究多集中",2019-07-15
"以客户为中心,构建全新智慧金融生态",吴益民;,北京讯鸟软件有限公司;,金融电子化,智慧金融;客户为中心;金融生态;,"近几年来,随着大数据、云计算、区块链、人工智能、移动互联等新一代信息技术的发展和应用,金融业正在大步迈进FINTECH时代。传统金融业受金融科技驱动,转型升级正当时,诸多新金融业态也在不断涌现,智能客服、智能营销等金融创新降低整体成本的同时,也在不断提升金融服务效率,推动构建全新的金融生态。其实,不管如何发展和进步,所有",2019-07-15
金融业如何迎接5G时代,本刊综合;,时代金融,时代金融,金融业;中国银行;工信部;浦发银行;理财顾问;中国联通;全息投影;生活馆;人工智能;物联网;,"6月初,工信部向中国电信、中国移动、中国联通、中国广电发放了5G商用牌照。中国5G商用时代正式到来。在人们翘首期待5G到底会如何改变生活时,我们身边的银行已经陆续被5G改变。5G银行网点陆续落地针对5G在金融领域的应用,银行业首家5G与生活深度融合的智能网点――中国银行5G智能+生活馆,已于5月20日在北京试运营。如果你有心,应该也从媒体报道被中行的5G智能+生活馆刷屏,并被里面动态的页面所惊艳。中国银行5G智能+生",2019-07-10
道德风险视域下的金融科技应用及其规制――以证券市场为例,袁康;邓阳立;,武汉大学法学院;,证券市场导报,金融科技;;证券市场;;道德风险;;金融监管,"以大数据、人工智能、云计算及区块链为代表的金融科技广泛应用于金融市场,在提高金融服务效率的同时,还具有降低信息不对称、弱化道德风险的效果。但由于金融科技自身属性,其在金融市场运用的过程中也可能产生新型道德风险。因而,规范金融科技应用规则并完善监管制度,以有效规制新型道德风险,是金融科技应用监管的现实需求。这有待于从金融科技的标准化、透明度、合规性等角度建立健全相关规则,并通过创新监管手段、明确监管责任,将金融科技应用纳入到有效监管的框架。",2019-07-10
新形势下我国金融科技发展研究与思考,韩玉军;邓灵昭;,中国人民大学经济学院国际经济系;中国人民大学经济学院;,现代管理科学,金融科技;;区块链;;人工智能,"金融科技对金融的影响是国家、社会、学术界等非常重视的课题。现阶段越来越多金融科技正应用于金融工具和金融市场创新的行为中。我国作为全球新兴的金融体系市场,更需要加强对金融科技发展的重视。文章就金融科技的发展历程予以梳理,总结了金融科技的重要内核和应用场景,对未来我国金融科技的发展趋势给与政策性建议。现阶段无论是银行、证券,还是保险等都有较大业务交叉,纷纷开始大资管、大投行的多条线业务并行发展,因此金融机构都应该更投入更多的人力物力到科技金融研发中,保持团队能具有开发持续性迭代产品的能力。此外,还要加强金融科技与监管的一体两翼式发展结构,从政策面引导金融科技良好发展,加大金融对实业稳步辅助。",2019-07-10
金融科技未来走向何方?,杨望;,瀚德金融科技研究院;中国人民大学金融科技研究所;中国人民大学国际货币研究所;,科技与金融,金融科技;经济体;投融资;生态格局;区块链技术;人工智能;未来走向;,"金融科技发展如火如荼,云计算、大数据、人工智能和区块链等新兴技术的实际应用变得越来越紧密。尤其是在金融行业的具体应用落地方面。经过近几年的迅猛发展,成熟的金融科技应用越来越多,金融与新兴技术的生态融合也逐步实现,金融科技将进入全新的发展阶段。基于大数据视角,我们能够观察到全球金融科技投融资趋势、政策布局与生态格局的全景图,洞",2019-07-09
金融科技助推之下的数字普惠金融,李秀梅;,四川新网银行消费金融部;,中国信用卡,数字普惠金融;风控体系;第三方开发者;大数据风控;SDK;金融科技;授信策略;信贷审批;高并发;生成效率;金融监管机构;消费信贷;无缝衔接;,"信息技术日新月异,潮流更新浩浩荡荡,技术流一波接一波,颠覆着各行各业,深刻影响着旧有观念和传统生产生活方式,金融生态和金融格局随之改变,新网银行也在这个大时代应运而生。带着互联网基因,通过大数据、云计算、人工智能等技术的加持,新网银行从初创之日起就走上了一条数字化探索之路。和传统银行相比,新网银行着眼于服务小微群体、支持实体经济、践行普惠金融,将数字技术一以贯之,凭借金",2019-07-07
