Title-题名,Author-作者,Organ-单位,Source-文献来源,Keyword-关键词,Summary-摘要,PubTime-发表时间
金融科技发展浅析,桂倩,东北财经大学,东北财经大学,大数据;;风险定价;;技术风险;;监管科技,"随着工业4.0时代逐渐临近,金融科技这一定义开始频繁得在科技,金融以及新兴的经济领域中被提及。以大数据,人工智能,区块链,云计算等为代表的新型技术开始与传统金融行业产生“化学反应”,并且逐渐渗透其中,对传统金融体系的营销模式,经营模式和消费模式产生了颠覆性的改变。在这样的宏观背景之下,金融科技之争也成为了实现经济发展的新的制高点。金融科技为何能发展如此迅猛呢?通过使用数据分析法和文献分析法,可以发现,技术的进步是最根本的动力。其次,传统金融体系存在的,迫切需要得到解决的供需不平衡现象也是金融科技产生的根本原因。再者,金融危机发生后金融机构合规成本上升,而金融科技处于初创期,相关规定较少,因此就有了监管套利的空间。21世纪各国为增强“软实力”纷纷出台相关政策来推动科技创新,这给金融科技的扎根生长提供了良好宽松的土壤环境。最后人口结构的变动以及消费结构的升级也成为了金融科技的蓬勃发展的催化剂。金融科技通过将新兴科技同传统金融业务结合,在降低交易成本的同时提高了金融服务的效率。通过对数据的挖掘与追踪,金融科技可以将传统技术无法识别或者无法量化的风险因素定量化,并且进行实时的监控,从而可以提高经济决策的科学性和准确性。金融科技使得金融服务跨越了时间和空间的限制,它改变了传统金融服务以产品端为出发点的战略,让用户自己参与到产品的研发中来,并且可以结合用户画像为消费者“私人定制”金融产品或服务,实现“个性化”操作。但是它也有着一些缺陷。比如过度依赖数据和底层技术,使得技术风险,操作风险,合规风险增加,还会导致传统的金融风险复杂化。同时它的高杠杆性,轻资产性也使得这些机构违约风险增加。此外,如何实现对数据和隐私的保护也成为了热点话题。京东金融作为金融科技行业里的代表性企业,它的发展历程和现状就是整个金融科技行业的缩影。虽然京东金融是一个成立并不久的公司,在行业里却处于领先地位。通过对比分析和深入研究可以得出,京东金融之所以能取得今天的成绩跟它坚定不移得发展科学技术,充分得扩展应用场景以及准确的自我定位和科学的战略规划有着密不可分的关系。但是金融科技毕竟是一个比较新的概念,企业在发展的过程中不可避免的会遭遇一些问题,例如消费者保护,企业信誉,技术风险等。这其实也是目前整个行业发展中常见的问题。结合当前宏观环境来分析可以得出结论:如果想为金融科技的发展之路扫清障碍,仅仅依靠公司的转变是很难实现的,还需要整个行业以及监管机构的共同努力。在微观层面上,公司应该坚定以技术作为核心竞争力,大力推动科技创新,培养技术人才梯队;完善对于消费者的保护机制,树立负责任、有态度的企业形象,增加用户的忠诚度;推进企业内部控制和合约制度建设,降低操作风险。在宏观层面上,我国需要发展监管科技,推动监管体系多元化建设。监管当局还应加强对金融科技的学习与认识,从而实现对症下药,灵活监管。当然,配套基础设施的建设也是必不可少的。金融科技未来发展会朝着普惠金融的方向发展,并且会更多得运用在中后台。我国作为金融科技发展的后来居上者,应该在对金融科技的内生机制进行深入的研究和把握以后,立足于中国国情,面向全球,加强区域性合作来推动我国金融科技的发展,并惠及到周边国家,为全球金融科技的发展提供更大的助力。本文在研究分析的过程中,结合大量数据和文献,通过对比研究,对金融科技的发展做了一个浅析。鉴于现有的文献多是从宏观框架上来阐述金融科技,本文引入京东金融的案例来从微观的角度切入,为金融科技的发展与应用提出建议。但是由于话题较新,京东金融内部数据很难获得,因此部分章节的研究可能不够严谨透彻。",2019-04-01
亳州药都银行金融科技发展路径研究,张晨,安徽大学,安徽大学,金融科技;;普惠金融;;差异化经营;;药都银行,"自金融科技(Fintech)的概念引入中国以来,自身及其相关产业已经成为国内投资者和创业者聚焦的热门产业,到2016年,中国金融科技融资总额已达到全球第一位。随着中国经济进入新常态,金融机构,特别是银行业,迫切需要借助以大数据、云计算、人工智能等为首的金融科技的力量,为实现产业转型升级提供新动能,更好地服务实体经济,顺应普惠金融的发展潮流。而在具体实施金融科技时,资源实力雄厚的大型商业银行与规模受限于区域的中小商业银行呈现出不同的发展模式。大型商业银行迅速占领前沿科技手段,在国内互联网巨头的研发实力加持之下,大刀阔斧地在全行上下实行改革。中小商业银行则由于自身条件无法满足科技研发投入、外部金融科技产业的不成熟、变化形式多且复杂等诸多因素,在如何应用金融科技上或止步观望,或盲目追随大型商业银行的应用模式,或耗费超过自身所能承受的资源成本进行多番尝试。目前,大多数中小银行都还处于探索如何将金融科技移植至银行体系的阶段。在此背景下,文章选择安徽省亳州市药都银行作为研究对象,基于银行经营环境,对其将金融科技在战略、组织结构、产品、服务与营销、风险防控等方面的应用进行分析和阐述,从中提炼出药都银行在短短一两年时间迅速扩张规模、成为业内典范的经验,对我国中小银行布局金融科技提出相关启示。在写作过程中,文章分为五个部分进行论述。首先,文章概括药都银行的发展历程,分别从存贷款业务、中间业务及经营业绩三个角度介绍药都银行经营状况。总体来说,药都银行目前经营状况较好,以个人贷款为主的贷款业务及营业收入呈现连年平稳增长的态势,主要利润增长点在利差收入,业务规模正处于不断扩张的状态,同时银行开发多种金融服务与银行卡的应用场景,凭借金融科技为银行赢得更广泛的知名度。其次,论述药都银行发展金融科技的动因,从内外部角度入手,分析药都银行在发展之中遭遇的问题,阐述在居民生活水平提升、互联网广泛普及、消费观念和行为改变、原有竞争格局改变的外部环境之下,主要服务地方经济、个人贷款占比多的药都银行,面临着盈利空间收窄与不良贷款率攀升的问题,恰逢政府开展建设智慧城市的项目,能够为银行提供大量数据资源,因此药都银行选择借用金融科技打开局面,为银行的发展与下一步扩张提供解决思路。之后,对药都银行在银行系统内应用金融科技的方面进行全方位剖析,分析得出,在实施金融科技的过程中,药都银行首先从战略上保障金融科技的实施,再将金融科技应用到产品、服务与营销、风控等方面。再通过梳理银行近几年因金融科技获得的荣誉以及业务范围扩张、业绩提升、风险防控能力增强这些效果,印证金融科技给药都银行带来了焕然一新的改变,同时也指出药都银行现阶段应用金融科技的不足之处。最后,依据前文分析的结果,文章站在中小银行的立场上,提出发展金融科技的启示:虽存在障碍,但我国中小商业银行在发展金融科技上仍大有可为;中小银行战略上主动调整,将金融科技植入银行发展策略之中,合理规划布局,不盲目模仿;在合理成本范围内发掘外部合作渠道,集思广益;坚持以客户为中心的发展理念,差异化经营,打造银行品牌特色;注重银行所有资源的合理调配,优化银行结构;还应注意做好银行安全防范工作,避免出现重发展轻防御可能引发的风险问题。",2019-04-01
金融科技与商业银行创新发展趋势,张靖朋;陈东壮;,长春理工大学经济管理学院;,商场现代化,金融与科技;;科技创新;;商业银行创新,"随着生产技术的变革,经济发展的方式也发生了转变。金融科技的崛起影响着商业银行的经营方式和经济发展方式。这种改变,让商业银行出现了互联网商业银行金融体系的新形态,这不仅让金融服务效率得到了很大的提高,而且对转化我国整体经济生产力起到了至关重要的作用。金融创新在需求层面有很大帮助,我国近几年在金融和经济上出现了双核驱动力的作用得益于互联网、大数据、人工智能等一些金融科技。本文在研究金融科技对商业银行创新所产生的影响的基础上,认识到金融科技在商业银行的重要性,最后思考如何更好地实现商业银行创新发展。",2019-03-30
上城区推动全国首个时尚数字体验中心建设,王斌;,杭州(周刊),杭州(周刊),体验中心;,"上城区联合落户望江金融科技城的杭州凌笛数码科技有限公司,共建之江文化产业带重点项目――全国首个时尚数字体验中心.并筹备人工智能实验室。该区以打造千亿级数字经济产业集群为目标,大力推进数字产业化、产业数字化、城市数字化,逐步提升数字经济比重和增长率,打造数字应用第一区。",2019-03-29
两岸金融科技发展趋势及其比较分析,朱健齐;陈怡忻;吕汶洙;,汕头大学;,华北金融,金融科技;;区块链;;大数据;;人工智能,"近年来,金融和科技出现了相互融合的趋势,金融科技也成为全球发展速度最快的领域之一。金融科技引领下的金融创新主要是指对金融市场、金融机构或金融服务的提供方式造成重大影响的科技创新活动,以中国大陆地区和台湾地区金融科技发展为背景,本文对两岸金融科技的发展速度、创新主体、服务对象、热点领域和发展方向等做了比较分析,同时也对两岸金融科技共同面临的风险与挑战进行了探讨。最后,文章从监管层、创新层和合作层三个层面对两岸金融科技领域如何构建合作、实现两岸共赢,提出了相关建议。",2019-03-25
金融科技风险及其防范化解对策,陈华;杨聪;,山东财经大学金融学院;,中国财政,金融科技风险;区块链;人工智能;大数据模型;传统金融行业;传统金融机构;化解对策;,"科技促进经济的增长,同样,金融产业的发展也需要科技的强力助推。当今新兴科技迅猛发展,互联网、大数据模型、人工智能等技术在金融定价、征信、风控、安全等方面的应用,颠覆了传统金融行业融资方式,使得各主体之间的互动更为频繁便捷。然而,金融科技所创造的新产品、服务和工作方式,对传统金融行业造成了巨大的冲击,使我国中小微企业在传统金融市场投融资进程中面临不",2019-03-25
金融科技在金融风险管理中的应用研究,谢关情;,中南大学湘雅公共卫生学院;,商讯,金融科技:大数据;;人工智能;;管理风险;;管理机制,"21世纪的到来,人类进入了一个崭新的时代。在金融领域,""科技""加""金融""概念让人们重新认识金融,同时这种新兴的方式也得到了人民群众的认可。不只是中国,全世界都在探讨这种使金融焕然一新的理念,即是利用科技为人们提供金融服务。其中大数据、人工智能等新兴产业,给人们带来了前所未有的便利。它提升了金融服务的效率,提升了金融产品的创新,加快了金融行业的发展,同时也为金融行业带来了前所未有的新的机遇和血液。然而,金融行业一直不曾离去的风险,在这种""科技+金融""的理念中依旧存在。怎么有效降低以及解决科技金融在金融管理中的风险,一直被人们关注。人们开始从多个方面着手解决金融科技在金融管理中出现的种种问题,经过多方的研究表明:人们应该积极利用科技,做好万全的管理机制,坚决守住不出现系统性的金融风险的底线。",2019-03-25
科技型小微企业成长的“困”与“解”:金融科技视角,潘锡泉;,浙江金融职业学院;,当代经济管理,科技型小微企业;;融资难;;金融科技,"科技型小微企业的成长面临着融资难、政策支持体系和扶持力度偏弱、自身创新能力不足、盈利能力和抗风险能力薄弱等现实问题,而依托于大数据、云计算、人工智能、区块链等技术的金融科技为科技型小微企业成长从模式、数据、模型和场景四个层面提供了可能的解决方案。大数据和云计算技术在破除信息不对称性、提高风险管控能力、降低融资成本和提升资源配置效率方面发挥重要作用,而人工智能和区块链技术的应用有助于金融服务场景的变革和渠道的拓宽及金融服务质量的深化。最后,文章基于金融科技视角,从依托政府政策支持体系来搭建有利于科技型小微企业成长的体制机制;依靠金融科技对金融业态的改造,加快金融机构转型升级来激发金融对科技型小微企业成长的支持力度;通过金融科技对科技型小微企业自身的功能性触动,来提升企业盈利能力和抗风险能力三个层面提出了化解科技型小微企业成长现实问题的策略建议。",2019-03-22
金融科技提升信托经营效率研究,段振茂,重庆工商大学,重庆工商大学,信托公司;;经营效率;;金融科技;;影响因素,"我国信托业自改革开放恢复以来,经历了六次行业清洗整顿,现已成为我国金融行业的四大支柱之一,对我国宏观金融市场的稳定健康发展具有重要作用。目前,我国信托业的发展已进入大资管激烈竞争、经济新常态、供给侧改革和金融科技蓬勃发展的叠加发展阶段,信托公司过去依靠政策保护和制度红利优势带来的资产大规模增长机遇将一去不复返,前期隐藏的风险将在宏观经济疲软下行换挡期逐渐暴露。另外,随着供给侧改革的深入推进,以及金融科技的高速发展,信托公司的转型过程将更富有挑战性,甚至呈现出优胜劣汰趋势。截至2017年末,信托行业资产规模高达26.25万亿元,但信托报酬率却急速下跌至0.42%,探究信托经营效率及其影响因素已是刻不容缓。基于此复杂背景,本文首先从理论上分析了信托行业的演化发展进程,接着从信托资产规模、盈利情况、信托业务收入和业务创新方面分析了信托业务的发展现状,行业发展整体趋于稳健态势,但代表经营业绩的信托报酬率持续下降。本文选取在金融领域应用最为成熟广泛,且经济意义明确和客观性较强的数据包络方法(DEA)对2013-2017年间61家信托公司进行效率测算,选取固有资产、硕博员工人数和信托费用作为投入指标,信托资产规模和业务收入作为产出指标,利用DEA-BCC模型对信托公司的技术效率和规模效率进行具体测算。研究发现,我国大部分信托公司的技术效率偏离有效状态,且公司之间的效率值存在较大差异,央企控股的信托公司拥有较好的规模效率。再者,本文从外部和内部因素两个角度,对宏观经济环境、社会信用水平、金融科技投入、人才质量水平、成本管理能力、风险管控能力和资本实力进行理论分析,接着构建Tobit面板回归模型对影响因素进行实证分析。结果表明,信托金融科技IT技术投入、风控能力、宏观经济水平、注册资本和成本管理能力对信托经营效率呈现正向关系,而人才质量则呈现与预期不相符的反向关系。最后,从金融科技角度提出改进信托经营效率的建议,即引入大数据整合行业资源,利用区块链重塑交易信任机制,通过人工智能提升服务质量,最后利用监管科技促进监管体系的完善。",2019-03-22
"金融科技赋能商业银行,构建普惠新生态",黄震;,现代商业银行,现代商业银行,供应链金融服务;金融业;上下游企业;商业银行;普惠金融发展;新生态;,"中国工商银行的供应链金融服务在经历了网络化、标准化阶段后,目前正积极布局场景化金融。通过丰富信息交互渠道、打造智能审批模式、加快标准化改造等措施,提升工行场景化融资服务能力,普惠供应链上下游企业。普惠金融,作为当前金融业普遍关注的热点,已成为一项国际社会和业界主流所认同的金融发展战略。与此同时,""互联网+""的推进,以及以大数据、云计算、人工智能等为代表的新兴科技在我国的纵深发",2019-03-20
如何运用人工智能梳理监管规则 优化银行业合规管理,童宇;,中国建设银行深圳分行内控合规部;,中国银行业,监管规则;数据化;合规管理;银行业;,"从长期来看,随着关键技术的突破,人工智能在监管规则梳理方面的应用会逐步拓展完善。合规创造财富,科技创造竞争力。先搭上人工智能合规管理这班车的银行,有可能在下一轮竞争中赢得先机。近年来,随着市场化发展的程度加大,经济结构调整转型升级和金融改革的持续深化,银行面临的合规成本和监管压力剧增。与此同时,不断发展的金融科技在银行领域应用风生水起。在这种背景下,银行迫切需要加速创新发展合规科技。金融科技的运用明显提升了各类业务的办理运行效",2019-03-15
运用金融科技实现全生命周期的金融消费者权益保护,姚辉亚;,微众银行;,中国银行业,金融消费者权益保护;微众银行;金融科技;全生命周期;,"随着金融科技时代的到来,相关的技术风险、交易风险、信息安全风险也越来越多,金融消费者相关权益保护的复杂度和难度也将越来越大。金融机构需积极应用新型金融科技手段,更好地保护金融消费者权益。随着人工智能、云计算、大数据及区块链等技术的发展,金融行业迎来了金融科技时代。科技改变了金融行业的生态,新技术与金融的融合正在推动金融行业对外服务模式和对内管理模式的深刻变革。金融科技在对金融服务赋能、实现金融创新的同时,金融机构是否可以应用新型金融科技手段,更好地做好金融消费者权",2019-03-15
渣打银行金融科技创新及其启示,杨飞;,中国工商银行城市金融研究所;,杭州金融研修学院学报,渣打银行;大数据分析;人工智能;移动支付;分布式;金融科技创新;国内商业银行;,"在欧洲,受客户交易习惯、反洗钱监管要求和客户信息保护等因素影响,移动支付对银行卡的替代和冲击尚不明显,短期内难以大规模应用。但数字化和信息技术革命改变了银行与客户间的互动关系。包括渣打银行在内的欧洲大银行正以提高客户满意度和忠诚度为目标,借助全新的金融科技理念和方法,打造超越传统银行范畴的增值服务。银行与金融科技企业的关系也由此前的竞争转向合作。本报",2019-03-15
金融科技时代商业银行网点转型的现状及趋势,孙东升;赖成阳;,对外经济贸易大学金融学院;,农村金融研究,金融科技;;商业银行;;网点转型,"随着互联网金融的快速崛起,商业银行传统业务受到巨大冲击。面对人工智能、大数据、金融科技的发展,商业银行离柜业务率不断攀升,我国商业银行物理网点转型迫在眉睫。同时,随着信息技术的发展,中青年客户群体成为金融科技消费的主体,商业银行也必须适应客户群体的更迭趋势,根据其特点进行转型与调整。论文结合金融科技的时代背景,阐述目前商业银行进行网点转型的必要性,在分析当前我国商业银行网点转型现状的基础上,指出我国商业银行网点转型过程中存在的问题,并结合美国富国银行网点转型的经验,提出我国商业银行网点转型的建议。",2019-03-15
《G20高级原则》视角下农村商业银行数字普惠金融的发展,张正平;刘旭晶;夏海;,北京工商大学经济学院;,农村金融研究,G20高级原则;;农村商业银行;;数字普惠金融;;金融科技,"随着近年来人工智能、大数据等金融科技的快速发展,传统金融机构与金融科技公司逐渐融合,合作共赢渐成趋势。金融科技的兴起为农村商业银行更好地服务""三农""提供了一条新的思路,但其应用也面临诸多的困难,亟待研究解决。论文从《G20数字普惠金融高级原则》视角出发,分析了近年来我国农村商业银行应用金融科技推动数字普惠金融发展的举措,然后揭示存在的问题、剖析导致问题的原因,并提出相应的政策建议。",2019-03-15
强化科技赋能 提升科技服务能力 为再造一个农业银行提供强有力的支撑和驱动,刘国建;,中国农业银行科技与产品管理局;,农银学刊,金融科技;;数字化转型;;信息化建设,"为顺应数字化时代客户行为变化和技术创新应用的发展趋势,商业银行纷纷启动数字化转型。金融科技的蓬勃发展为商业银行数字化转型提供了强劲的驱动。农业银行将充分借助近几年金融科技创新成果的积累,按照互联网化、数据化、智能化、开放化的要求,以业务战略为导向,全力推进IT架构转型,不断强化系统整合与互联互通,支持产品与服务的快速构建、敏捷创新,通过强化科技赋能业务和提升自身科技能力,为数字化转型提供安全稳定、整合共享、灵活高效、坚强有力的科技支撑和驱动。",2019-03-15
金融科技在信用风险智能化管理中的应用――商业银行的选择与应对,中国农业银行信用管理部信用风险智能化管理课题研究组;张晓男;马柔;,农银学刊,农银学刊,金融科技;;信用风险;;智能化管理,"大数据、云计算和人工智能等金融科技的快速发展,为商业银行创新金融服务、加强信用风险管理提供了有力的技术支撑。本文立足于商业银行信用风险管理实际,分析金融科技进步对信用风险管理的影响,借鉴运用金融科技进行信用风险管理的先进经验,规划商业银行应用金融科技进行信用风险智能化管理的框架、蓝图和路径选择。",2019-03-15
科技助力管控金融系统性风险,李明富;,金融电子化,金融电子化,金融系统性风险;人工智能;,"金融安全是国家安全的重要组成部分,是关系我国经济社会发展全局的一件带有战略性、根本性的大事。党的十八大以来,习近平总书记反复强调要把防控金融风险放到更加重要的位置,牢牢守住不发生系统性风险底线,采取一系列措施加强金融监管,防范和化解金融风险,维护金融安全和稳定,把住发展大势。2月22日,在中央政治局第十三次集体学习会议上,习近平总书记再次强调,防范化解金融风险特别是防止发生系统性金融风险,是金融工作的根本性任务,金融",2019-03-15
2019科技大预测,郭嘉凯;,软件和集成电路,软件和集成电路,新一代信息技术;人工智能;细分行业;区块链;,"过去两年,新一代信息技术的崛起,给整个IT产业带来了巨大的变化。大数据、人工智能、区块链、城市大脑、金融科技、无人驾驶、数字经济、5G等新名词、新技术可谓是风起云涌,轮番成为行业和资本追逐的热点。但进入到2018年下半年以后,这种热度逐步减退。可以看到,一些此前知名度较高的AI、大数据、区块链等初创企业,渐渐消失在主流视野中。之所以如此,与这些企业的商业化落地能力有着直接的关系。创业企业在成立初期,可以靠",2019-03-12
智能投顾中投资者适当性制度研究,杨东;武雨佳;,中国人民大学法学院;中国人民大学金融科技与互联网安全研究中心;,国家检察官学院学报,科技金融;;互联网金融;;人工智能;;智能投顾;;资产管理;;投资者适当性,"2018年4月27日《关于规范金融机构资产管理业务的指导意见》对""智能投顾""进行了专条规定。智能投顾由于其技术特性,业务流程的各个环节对投资者权利保护带来了新的问题与挑战,主要体现在智能投顾运营模式与现有法律规定存在一定的冲突、智能投顾在实际运作中对投资者测评不够充分、智能投顾提供建议时违反信义义务和信息披露的风险等。鉴于此,本文在学理层面上阐述投资者适当性的基础理论,建议在智能投顾领域中对传统投资者适当性制度进行调整,构建以投资者保护为核心理念、科技监管为重要手段,协调现有法律规范的投资者适当性制度体系。",2019-03-10
