Title-题名,Author-作者,Organ-单位,Source-文献来源,Keyword-关键词,Summary-摘要,PubTime-发表时间
应用金融科技创新服务小微企业的途径与机制研究,李慧;,中国工商银行股份有限公司天津市分行;,第三十四届中国（天津）2020’IT、网络、信息技术、电子、仪器仪表创新学术会议论文集,融资困境;;金融科技;;小微企业,"近些年来,人工智能、区块链、云计算和大数据成为了各行各业的焦点,传统金融业包括商业银行在内,寻求金融与科技的深度融合,产生了""金融科技""这一新兴领域。小微企业长期面临的融资困境的问题迟迟未能得到解决,金融科技为商业银行创新服务小微企业、解决其贷款难以及其他方面的问题提供了新的思路。本文以商业银行的实际情况为背景,研究商业银行利用金融科技服务小微企业的现状以及遇到的种种挑战,并结合了国内外一些商业银行金融科技发展的成功案例,分析了商业银行在金融科技方面的发展途径和机制,并对今后商业银行如何运用金融科技发展小微企业服务提出了发展建议。",2020-08-17
金融科技研究进展与评析,鲁钊阳;张珂瑞;,西南政法大学经济学院;,金融理论与实践,金融科技;;金融创新;;金融发展,"从历史的角度来看,金融科技的产生是数百年来技术变革的必然产物,大数据、区块链、云计算、人工智能等前沿新兴技术的发展为金融科技的兴起奠定了基础。政府的扶持、科技的进步、人口因素及消费者偏好的变化、传统金融体系自身的漏洞为金融科技的稳步发展创造了条件。法制的不健全、金融科技自身的某些弊端、金融市场发展的不完善以及专业人才的匮乏,严重制约着金融科技的发展。要有效促进金融科技的发展,需要健全金融科技发展的法律法规,革新既有的对金融科技监管的具体措施,完善金融市场的各项建设,加快金融科技高素质人才的培育和引进力度。",2020-08-12
打造科技创新引擎 赋能业务价值创造,陈满才;,中国工商银行金融科技部;,中国金融电脑,云计算平台;物联网;人工智能技术;普惠金融发展;服务实体经济;工作体制机制;产学研用;银行业;工商银行;业务转型;防范化解;全流程;区块链平台;社会各界;分布式技术;金融风险;业务价值;,"当前,金融科技已逐渐从后台走向前台,成为推动金融转型升级的新引擎、金融服务实体经济的新途径、促进普惠金融发展的新机遇、防范化解金融风险的新利器。下一步,工商银行将继续按照""科技驱动、价值创造""的指导思想,不断完善创新工作体制机制,携手社会各界力量,强化产学研用联合创新,更加主动地拥抱金融业务转型发展,持续发挥金融科技在服务实体经济、发展普惠金融、防控金融风险工作中的赋能驱动作用。",2020-08-07
新兴技术创新应用重塑金融服务 助力金融业数字化战略转型,赵希同;,中国银行信息科技部;,中国金融电脑,监管效能;新兴技术;区块链;差异化优势;容错纠错机制;数字化转型;创新应用;金融业;银行业;金融科技创新;云计算;组织架构;体制机制改革;全流程;金融风险;数字化发展;人工智能;中国银行;战略转型;物联网;交付能力;,"面对金融竞争的新常态,商业银行要顺势而为、及时转型,利用新兴技术撬动金融创新,构建以客户为中心的差异化、专业化金融服务交付能力,成为集约化、智能化金融服务先驱者。商业银行应积极拥抱新兴技术,打造难以被逾越的差异化优势,同时,对新兴技术的应用也要有科学的认知,以业务适用性为原则,以解决业务痛点为切入点,推动技术和业务融合,体现新兴技术的实际价值与效用,并遵循新兴技术应用创新的客观规律。面对不确定性,商业银行要配套提升组织的灵活性和适应性,建立试错容错的文化。从试点入手,通过迭代交付,根据市场反馈逐步展开,真正发挥金融创新的价值。",2020-08-07
"发力新技术创新,为金融服务注入新动能",寇冠;,中信银行信息技术管理部;,中国金融电脑,中信银行;技术服务平台;物联网;平台体系;科技创新工作;区块链;人工智能;供应链金融;数字货币;技术驱动;新动能;技术创新;金融服务;,"中信银行秉承""新技术驱动、价值导向""的科技创新理念,兼顾互联网""快""和银行""稳""的特点,重点发力人工智能、区块链、RPA、5G、物联网等新技术的运用,对量子计算、边缘计算等新技术保持前瞻性和敏锐度,在创新探索的道路上始终坚持""十六字""箴言:创新要""勇""、创新要""全""、创新要""实""、创新要""快""。目前,中信银行已打造出自主可控的新技术平台体系,形成前瞻性的技术布局,从以往的""点状""""线状""向""网状""辐射,创新规模化应用逐步显现。与此同时,创新的最终目的是为金融服务,新技术作为未来金融创新和数字化能力的重要驱动力,需要中信银行以价值和效能为目标,通过渐进式和创造型创新相结合的方式,实现技术平台化、应用创新化、模式颠覆化,稳步推进全行金融科技创新工作。",2020-08-07
聚焦科技创新 智造数字光大,史晨阳;,中国光大银行信息科技部;,中国金融电脑,光大银行;科技创新机制;云计算平台;智能服务;研发平台;金融科技创新;分布式架构;数字化转型;支撑能力;银行业;普惠金融;专项经费;人工智能技术;分布式数据库;,"逆水行舟,不进则退。面对新时代复杂的内外部经济形势,光大银行将坚定战略发展定力,稳中求进,积极开展技术创新实践,深化科技业务融合,在把控风险的前提下,始终将科技创新作为驱动银行发展的核心动力,加快数字化转型进程,为助力实体经济发展提供有力支撑。",2020-08-07
金融科技背景下中小金融机构转型探析,吴华晖;,湖南省农村信用社联合社信息科技部;,中国金融电脑,中小金融机构;中国人民银行;科技发展规划;普惠金融;分布式数据库;集中式;云计算;云资源;省联社;,"人工智能、大数据、云计算等技术的发展加速了科技与金融的融合,颠覆了传统银行的经营服务模式,驱动商业银行等金融机构的转型发展。中国人民银行《金融科技发展规划(2019-2021年)》明确指出,要合理运用金融科技手段丰富服务渠道,提升金融服务质量与效率,推动实体经济健康可持续发展。本文拟针对中小金融机构的实际,分析其金融科技转型所面临的挑战,从基础架构、渠道、生态体系三个方面对转型路线进行探讨。",2020-08-07
改革创新迎接零售银行的春天――农业银行信用卡数字化运营创新探索,卢河英;,中国农业银行信用卡中心;,中国信用卡,银行信用卡;信用卡中心;零售银行;创新探索;,"随着大数据、人工智能、移动互联网、云计算等金融科技的发展,客户的行为习惯发生了显著变化,客户离柜化削弱了传统银行的网点优势,科技成为银行业务发展的核心驱动力,传统零售业务的渠道运营、产品供给、获客方式和客户经营模式正在被颠覆,竞争形势发生了深刻变化。得客户者得天下,以客户为中心的数字化转型成为银行近几年的战略方向,作为银行最具互联网基因和创新能",2020-08-07
5G将如何重塑金融业,薛洪言;,苏宁金融研究院;,中国信用卡,供应链金融;金融业;物联网技术;,"2020年3月4日,中共中央政治局常务委员会强调要""加快5G网络、数据中心等新型基础设施建设进度"",给5G时代的来临按下了加速键。5G作为底层通信网络,是数字经济、人工智能、工业互联网等新经济创新发展的基础设施。与4G网络相比,5G以更快速度、更多连接、更低时延、更高可靠为特征,与人工智能、大数据、云计算、物联网等结合起来构成新一代信息基础设施的核心能力,必然会催生出新的商业模式,改变社会生活的方方面面。在5G时代,金融业没有不变之理。",2020-08-07
基于商业银行的金融体系现状及发展研究,陈顺德;,中国建设银行股份有限公司厦门市分行;,中国中小企业,商业银行;人力资源;互联网金融;人工智能技术;现状及发展;,"建设商业银行金融科技体系的内涵建设商业银行的金融科技体系就是指充分利用传统商业银行以及金融科技的各自优势并进行适当的融合,进而推动商业银行进行创新转变。这一创新思想符合国家提出的相关战略战术的要求,同时也满足我国建设社会主义现代",2020-08-01
全球数字经贸规则的最新发展与比较――基于对《数字经济伙伴关系协定》的考察,赵DE;彭德雷;,上海交通大学凯原法学院;华东理工大学商学院;华理-临港自贸区研究院;,亚太经济,数字贸易;;《数字经济伙伴关系协定》;;区域贸易协定,当前，全球关于数字经贸规则的谈判引人关注，并呈现多元发展动态。新加坡、新西兰和智利共同签署的《数字经济伙伴关系协定（DEPA）》，成为全球数字经贸规则的一股新力量。DEPA协定旨在建立新的跨境数字经济制度安排，以便为企业在数字经济中的蓬勃发展创造机会。DEPA协定还将促进各方在新兴数字领域的合作，通过调整标准并解决数字化带来的新问题。协定中涉及的电子发票、数字身份、金融科技、人工智能、数据流动和数据创新等都值得后续关注。,2020-07-29
探索商业银行数字化转型之路,杨燕飞;,中国农业银行股份有限公司山西省分行;,中外企业家,商业银行;;金融技术;;数字化转型,"面对激烈的内部竞争和日趋严苛的外部监管环境,商业银行需要不断探索业务创新和改革方向,抓住金融技术加快更新迭代的机遇期,探索适合自己的数字化转型之路,充分利用安全技术、分布式技术、互联技术,以及人工智能、大数据等技术保障转型过程中的安全。",2020-07-25
证券监管中应用人工智能的风险规避,孙刚;,黑龙江大学;,商业经济,人工智能;;证券监管;;金融科技;;风险,"以人工智能为典型代表的金融科技呈现出蓬勃发展的趋势,现已广泛应用于证券市场。将人工智能应用于证券监管制度体系有助于完善证券监管模式,提高监管效率,是适应时代发展的必然选择。但现行证券法律体系和监管模式相对滞后,人工智能技术自身亦存在缺陷,导致人工智能在证券监管过程中面临诸多风险。因此,应积极顺应时代的变革,围绕应用的效能和影响,及时对现行法律体系和配套制度做出修订和补充,在证券监管中审慎运用人工智能,与人工监管进行有机融合,积极探索发展新型监管体系,与区块链等其他金融科技融合,加快我国证券市场监管的科技创新,是规避人工智能等金融科技在证券监管中存在或潜在风险的有效路径。",2020-07-20
新冠肺炎疫情冲击下的银行业金融科技应用:理论逻辑、实践特征与变革路径,肖宇;李诗林;梁博;,中国社会科学院研究生院;清华大学全球私募股权研究院;中央军委审计署;,金融经济学研究,COVID-19;;金融科技;;数字经济;;大数据;;人工智能,"数字时代的发展规律显示,数字化和信息化是商业银行推动自身转型升级的必然趋势。研究发现,此次新冠肺炎抗疫战期间,金融科技在有效助力中国商业银行应对危机中发挥了重要作用,主要体现在金融科技有效降低物理场所经营风险,有助于压缩存量贷款余额风险敞口,能够帮助商业银行实现资产投放的精准滴灌,切实提升商业银行的内部风险管控水平,助力商业银行有效应对跨界竞争等多个方面。后疫情时代,商业银行应该积极推动金融科技变革,继续夯实金融科技底层技术,不断丰富金融产品与服务矩阵,守住不发生系统性风险底线,协调推动银行业双向开放,做好人才队伍培育和支撑,积极参与金融科技国际规则制定。",2020-07-20
潘云鹤:金融科技迈入智能化时代,潘云鹤;,中国工程院;国际欧亚科学院;,今日科技,人工智能技术;群体智能;区块链;混合增强;智能化趋势;数据智能;智能化时代;金融科技;,"日前,之江实验室人工智能领域首席科学家、中国工程院院士潘云鹤,以及来自浙江大学、中山大学、中国人民银行杭州中心支行、华为等学界、监管界、企业界的专家学者和行业大咖齐聚中国(杭州)人工智能小镇,以""科技让金融更安全""为题,共话金融科技前沿热点。9场主题演讲、1场圆桌对话,长达3个半小时的2020西湖论剑・网络安全线上峰会""金融安全与区块链论坛""直播干货满满。大数据、人工智能、区块链、隐私计算、金融监管等成为这场论坛的高频词汇,呈现出新金融业态下科技赋能的无限可能。潘云鹤表示,金融科技的发展过程可分为金融电子化、金融网络化和金融智能化三个阶段。当前,先进的企业正在从网络化向智能化发展,从大数据技术向人工智能技术发展。他认为,我国金融科技智能化趋势的四大关键领域为金融风控、精准营销、深度服务和金融监管。大数据智能、群体智能、跨媒体智能、人机混合增强智能和自主智能系统等AI 2.0关键理论与技术,将为未来金融业发展提供无限可能,推动金融业实现跨越式发展。",2020-07-20
科技金融 数字赋能 2020年第二期“质量大讲堂”活动举办,嘉怿;,上海质量,上海质量,大讲堂;人工智能;数字化转型;阿里云;风险管控;,"7月16日,2 0 2 0年第二期(总第十六期)""质量大讲堂""公益活动,以""现场开讲""与""在线直播""同步的方式,在太平洋保险集团大厦举办。本期质量大讲堂与世界人工智能大会相映成趣,以""科技金融、数字赋能""为主题,由市质量工作领导小组办公室、上海市市场监督管理局指导,上海市质量协会主办,中国太平洋财产保险股份有限公司协办。来自腾讯金融、画龙科技、阿里",2020-07-20
广东金融高新区:构建区块链产业生态 培育竞争新优势,潘慧;郑乐华;,广东科技,广东科技,区块链;高新区;人工智能;科技产业集聚;区块链技术;竞争新优势;,"当前,以大数据、云计算、人工智能和区块链为代表的金融科技逐渐成为驱动金融发展的新动力,对大大提高金融服务的覆盖率、金融产品的使用率、金融监管的渗透率发挥了决定性的作用。为深入贯彻党的十九大精神,落实""深化金融体制改革,增强金融服务实体经济能力""的要求,抢占新一轮以区块链领衔的金融科技发展先机,进",2020-07-15
基于数字经济的消费金融发展问题研究,廖春萍;,广东工程职业技术学院;,商场现代化,数字经济;;消费金融;;新兴技术;;金融科技;;金融普惠,"现阶段,我国消费金融在数字经济的推动下得到了快速发展,特别是云计算、区块链、大数据和人工智能等新兴技术的出现,这些新兴技术和金融创新融合使得消费金融的服务模式发生了改变,消费金融市场向多元化方向发展,而且消费金融业态不断更新换代,金融科技公司、消费金融公司和商业银行共同组成了一套消费金融体系,金融普惠在服务实体经济和服务消费两方面的推动下进一步提高了便捷性,重视消费金融安全、防范风险成为了数字经济时代消费金融发展的重要方向。",2020-07-15
长江证券数字化营销引擎与应用,郭正彪;王圆圆;黄振森;,长江证券;,金融科技时代,金融科技;;智能营销;;客户画像,"随着金融科技的发展,证券行业的获客及服务方式都在发生着变化,由""网点模式""为主演化为""线上引流""为主,客户规模也与日激增。但客户群体的不断增大,也使营销人员对于客户服务力不从心。本文在此背景下,从长江证券自身业务出发,介绍了公司利用大数据、人工智能等技术所构建的一套完整的智能营销引擎,并结合自身实践,总结了包括客户分发、流失预警等在内的多个案例实践,对工程实践应用进行反思与总结。",2020-07-10
商业银行数字化转型要有差异化,杨望;刘婧然;,瀚德金融科技集团;中国人民大学金融科技研究所;北京语言大学商学院;,金融博览,数字化转型;差异化竞争;商业银行;,"近年来,互联网思维和大数据思维被广泛运用,经济社会运行方式随之发生变化,新产品、新业务、新业态层出不穷,数字化转型成为各行各业的热点。数字化转型是建立在数字化转换、数字化升级基础上,以新建一种商业模式为目标的高层次转型。金融科技所包含的大数据、云计算、区块链、人工智能等新",2020-07-08
疫情下金融机构与金融科技企业的融合大势,马近朱;,国际银行卡组织;,中国信用卡,支付服务;金融服务;在线购物;金融生态圈;中国银联;,"2020年一季度,新冠肺炎疫情在全球多点暴发,各国政府纷纷要求民众减少外出,鼓励远程办公。金融机构延续疫情前与金融科技企业的合作势头,加大应用大数据、云计算、人工智能等金融科技的力度,推动数据赋能服务进入个人生活和企业运转领域,触发""非接触""金融服务和在线商务的全球大发展。后疫情时代,金融机构与金融科技企业的融合必将加速。",2020-07-07
金融科技在资产管理中的应用及风险防范发展现状――以“智能投顾”为例,张兆鹏;,北京工商大学数学与统计学院;,市场周刊,金融科技;;智能投顾;;资产管理;;风险管理,"金融科技依托大数据、区块链等高新技术与传统的金融行业融合,不仅能降低成本、提高传统金融行业的效率和收入,还能在商业模式中不断创新、衍生出新的业务机会,其中就包括资产管理的应用。当下新兴技术促进财富管理变革的同时,""高门槛、高收费""的传统投资顾问模式已无法适应我国普惠金融的发展需求。因此,拥有门槛低、费率低且信息透明度高等优势特征的智能投资顾问平台在我国应运而生。然而从国际上来看,当前金融科技的发展及研究并不平衡。从国内外智能投顾市场研究现状的角度出发,对金融科技在资产管理中的应用和风险管理展开研究评述。",2020-07-01
金融科技背景下高职理财专业人才培养研究,张兴夏;,福州职业技术学院;,产业与科技论坛,金融科技;;高职教育;;理财专业;;人才培养,"伴随着以人工智能、大数据、区块链为代表的金融科技的快速发展,对理财人员素质也提出了新的要求。高职院校可以通过优化课程体系、加强师资队伍建设、构建四元协同育人机制等措施,培养满足金融科技快速发展的理财专业人才。",2020-07-01
金融科技在银行业的应用研究,金仝仝;,瑞安市金融工作服务中心;,时代金融,金融科;;银行业;;ABCD技术应用,"基于当前传统金融到互联网金融,再向科技与金融融合转变的发展情形,以银行业为主要切入点,对比金融科技和科技金融的内涵和运营方式的不同,并通过人工智能、区块链、云计算、大数据这四类金融科技在银行业的具体应用,分析四类金融科技具体对接银行业某一业务的实际案例,分析其案例的成功经验,同时提出金融科技在银行业的不足之处,提出下步创新与风险、成本与收益、技术与人才这三方面的应用建议,推动银行业高质量的发展。",2020-06-30
人工智能在金融领域的应用及监管,张文婷;赵大伟;丁明发;,中国人民银行金融研究所;中央财经大学中国金融发展研究院;,金融纵横,人工智能;;科技监管;;金融科技,"近年来,金融科技的发展与应用为各行业带来了前所未有的机遇,尤其是人工智能在金融领域的应用不仅有助于金融业提质增效,也成为金融机构保持竞争优势和转型升级的重要驱动力。值得注意的是,在科技为金融业注入强劲发展动力的同时,也使传统金融风险产生了异化并引发了一系列新的风险问题,给现行金融监管提出了新的挑战。本文对美国、欧盟、英国、加拿大、日本、新加坡等国家和地区关于人工智能在金融领域应用的经验和监管政策进行梳理和总结,并提出相关政策建议。",2020-06-25
银行业数字化经营的核心能力分析及建设路径,杨晴;王婷希;,中国建设银行〈马来西亚〉有限公司;中国建设银行股份有限公司;,工程经济,数字化经营;;金融科技;;建设路径,"银行数字化经营成为行业趋势,以金融科技为主要经营理念,运用前沿科技成果(如:人工智能、区块链、大数据、云计算、物联网等)改造或创新金融产品、经营模式、业务流程,不断使得银行获客效率提升、风控效果提高、产品设计精细化与差异化、成本结构的优化等,推动传统银行业发展提质增效,本文基于此,提出银行数字化经营的建设路径,最大化提高银行效能,以做好转型准备。",2020-06-20
金融科技浪潮对高校金融专业人才培养的影响,张治钦;张辰源;怀佳俊;曾楠;,北京联合大学管理学院;,时代金融,金融科技;;高校金融人才培养;;复合型人才,"随着云计算、大数据、人工智能和区块链等新兴技术在金融行业的深入应用,科技对于金融的作用被不断强化,创新性的金融解决方案层出不穷,金融科技发展进入新阶段。在金融科技迅猛发展的浪潮中,复合型的金融人才至关重要,然而目前金融人才供不应求。本项目在此背景下,通过实地考察、文献检索、现场访谈等方式,分析金融专业人才必备素质,针对高校金融专业人才培养存在的不足,提出改进建议和对策,从而更好的推动金融专业人才的培养,对于高校金融专业建设有一定参考价值。",2020-06-20
前沿科技对金融审计的影响研究以人工智能信贷审阅工具为例,裴东霞;,西京学院;,行政事业资产与财务,前沿科技;;金融审计;;人工智能;;信贷,"本文以人工智能信贷审阅工具为例,分析了该信审工具的特点和优势。另外,以前沿科技对金融审计的积极影响进行阐述,并指出金融审计面临的挑战,最后对金融审计的发展提出合理化建议。",2020-06-18
农商行普惠金融数字化转型,付东升;,北京农商银行;,中国金融,农商行;普惠金融;数字化转型;,"新冠肺炎疫情的暴发在物理空间上拉开了社交的距离,给经济社会运行造成了重大影响,也为银行业金融服务供给主体带来巨大的挑战。为满足疫情防控与金融稳定的现实需要,保证金融服务不间断,银行业金融机构大力使用5G、云计算、大数据、人工智能等新技术,加速推进金融服务向数字化的转型。农商行在普惠金融发展的过程中,更需要积极研究探索金融服务新模式,进一步提升普惠金融服务的覆盖面和便利度。",2020-06-16
金融科技视野下中小证券投资者权益保护法律机制研究,汪世虎;陈素华;,西南政法大学民商法学院;,西南政法大学学报,金融科技;;证券投资者保护;;公司治理;;竞争监管;;信息披露,"金融科技给中小证券投资者权益带来挑战,其保护制度的相应调整成为当务之急。证券投资者权益保护的信任系统正在发生前所未有的变化,法律机制与技术机制的区隔、过度行政干预下的司法救济使中小证券投资者权益面临理论和实践的考验。中小证券投资者权益保护制度的重建,应从理论层面厘清制度构建与金融科技规则的融合。在理论上,鼓励创新使代理理论成为制度重建的理论基点,而信息公开使监管竞争理论具备成为理论基点的正当性。为此,证券投资者权益保护法律机制需从两个维度秉持不同原则:宏观维度采取去中心式监管竞争理念,微观维度实施促进创新的公司治理和采取与金融科技相融合的示范诉讼机制。",2020-06-15
