Title-题名,Author-作者,Organ-单位,Source-文献来源,Keyword-关键词,Summary-摘要,PubTime-发表时间
我国金融科技监管法律制度研究,王翠竹,华中科技大学,华中科技大学,金融科技;;监管改革;;制度创新;;金融消费者权益保护,"以大数据、云计算、人工智能等技术为支撑的金融科技正在全球范围内兴起。金融科技为金融市场注入了新活力,同时也使各种风险状况不断加剧甚至演变。国际组织和各主权国家都着手积极探索有针对性的监管策略。对于金融科技的监管若得当,有利于增强对我国金融消费者利益的保护,完善我国金融法制建设,防范系统性金融风险。同时,对于争取我国在金融科技领域的领导地位、掌握在国际金融话语权也具有积极意义。但随着e租宝事件、泛亚金属交易所事件、侨兴债事件等接连发生,不仅损害了金融消费者权益而且严重扰乱了金融市场的秩序。暴露了我国现行监管制度的滞后与失灵状态,给监管机构带来挑战。金融科技的迅速发展倒逼监管改革,法律是治国之重器,通过法律制度建设规范金融科技,引导金融科技行业朝着有效管控风险和有益于金融消费者权益的方向发展。围绕这一目标,我国金融科技监管法律制度研究运用比较研究法、归纳与演绎的研究法、学科交叉研究法,从以下几个方面进行了探索:首先,从金融科技的概念分析入手,剖析了“互联网金融”与“金融科技”的内涵差异,确立了以范围更大,影响更广的“金融科技”为研究对象;并在梳理了目前全球金融科技监管现状的基础上,分析我国金融科技监管制度的演进。其次,以金融科技监管法律关系主体、金融科技监管应该把握的“度”和我国金融科技监管制度的弊端为视角,详细阐述我国金融科技监管制度需要变革的原因。再次,分析了目前境外较为成功的金融科技监管制度创新成果,并作出评价:“监管沙箱”是监管主体为应对金融科技发展,在现行监管模式上做出的调整。能够促进金融市场中真正的创新发展,提升监管的弹性和灵活度,有效的平衡金融科技创新和风险控制;“淡中心化监管”这种多主体协同合作的监管模式,不仅在一定程度上平衡了分布式总账参与方与其他利益相关方之间的权益,使得金融科技在发展过程中预防系统性金融风险的发生。还可以避免过分严格的金融监管将金融创新扼杀在摇篮中;风险评估的分析框架从各个条件和其可能产生的影响方面对金融创新项目进行评估,为各国监管机构有效的监管金融科技提供了操作指南,也为未来国际金融监管制度变革指明了方向。随后,从英美等国和FSB有关金融科技监管的制度创新成果中得到启示,在“嵌入”型思维的指导下,尝试性的探索出我国金融科技监管制度变革应该遵循的路径是:以“试验主义”监管为变革方向,以“监管科技”为变革手段。借助于“监管科技”构建一个可以与金融科技的业态特征,发展状况、风险程度相匹配的“试验主义”监管,能够有效的把握金融科技监管的“度”,在鼓励金融科技创新的同时防控金融风险。最后,在立足于我国当前金融科技监管体制现状的前提下,尝试性的提出如何更好的完善我国金融科技监管制度的几点思考和建议。笔者认为,主要可以从这三个方面完善我国金融科技的监管制度:从具体规范金融科技的测试申请主体、实施主体、运作流程及消费者保护措施等方面构建中国版监管沙箱法律制度;从金融科技监管主体和市场主体两个层面入手,利用“监管科技”构建有利的监管协调机制;在金融立法和各种决策中要贴近金融消费者保护,可以从建立金融消费者反馈机制和建立金融消费者教育制度两个方面入手。使我国金融科技领域呈现出一种风险可控、金融消费者参与、公平有序的新局面。",2018-05-01
金融科技与银行信用风险管理,袁媛;,中国邮政储蓄银行;中国人民大学财政金融学院;,中国金融,银行信用风险管理;信用风险管理体系;金融科技;授信决策;,"在金融改革和发展的新形势、新环境、新要求下,银行如何更加前瞻、有效地开展信用风险管理,提升风险防控能力,是亟待认真思考、解决的重要问题。新兴的数字化技术、金融科技(Fin Tech)异军突起,为我们解决这一问题提供了全新的视角。通过大数据分析、人工智能等关键的技术应用,可以改变""从历史看未来""的方法,尝试构建""从数据/信息看当下,从特征看未来""的方法论,打造覆盖风险识别、计量、决策、实施全流程的信用风险管理体系。",2018-05-01
金融科技股强势复苏,杨旭然;,英才,英才,科技股;恒生电子;,"中国金融科技在完成初级的信息化布局后,仍然有庞大的市场空间等待""精进""。一段时间以来,金融企业特别是银行机构大量裁员,成为了人们密切关注的话题。对于银行职员、证券公司交易员们来说,失去工作意味着更艰难的生活,但对于这些金融机构来说,大量冗余的人力资源会拖累盈利能力。曾经重要的人力资源,为何成为了企业必须脱手的""负资产""?其最核心的根源在于金融科技的发展,大幅度的提升了金融企业的工作效率。无人化的银行常规业务办理,股票的自动量化操作甚至是人工智能决策,都对传统的人类劳动产生了前所未有的冲击。",2018-05-01
互联网金融对商业银行的影响探究,陈应,恒生电子股份有限公司,浙江大学,互联网金融;;平安银行;;影响;;对策;;金融科技,"互联网金融作为一种新的金融模式,越来越受人们的关注。它的发展不仅对人们日常生活形成了重大影响,同时对传统的金融机构比如商业银行也造成了一定的冲击。所以,对互联网金融的分类、主流技术与作用于商业银行的影响等进行分析,并提出相应措施是极具现实意义的。若想对互联网金融作用于银行方面的影响进行全面的了解,则必须将银行各个主营业务分离出来,再借助相关数据进行具体分析。本文开篇首先概述了互联网金融的内涵、主要类型以及当下主流的互联网金融及时,从而引出互联网金融对商业银行的影响。其次,将平安银行历年的存款余额、贷款总额、营业收入总额、利息净收入等财务数据进行收集并分类整理,展开专题性质的理论研究;利用调查和数据分析了解平安银行在互联网金融方面的发展情况以及互联网金融对平安银行资产业务、负债业务、中间业务等方面产生的影响。最后,通过将平安银行与互联网金融公司在客户群体数量、盈利模式、经营理念等方面进行比较,以SWOT分析法对平安银行应对互联网金融所带来的优、劣势与机遇及挑战进行分析,并提出运用人工智能、大数据、云计算、区块链等互联网金融技术提升竞争力的建议。",2018-05-01
金融科技赋能商业银行风险管理转型,姜增明;陈剑锋;张超;,中国农业银行博士后科研工作站;北京大学经济学院;中国农业银行战略规划部;,当代经济管理,金融科技;;商业银行;;风险管理;;转型升级,"风险管理是商业银行的立身之本,科技是推动商业银行不断提升风险管理水平的重要因素。大数据、云计算、物联网、区块链和人工智能等新一代信息技术的发展和应用,开启了金融科技――FinTech时代的来临。商业银行在积极深化互联网金融的基础上,通过收购、投资、战略合作等多种方式布局金融科技,以打造全新的核心竞争力。金融科技不仅对商业银行提出了新的要求,也给传统风险管理带来新的机遇,赋能其转型升级。文章针对传统商业银行风险管理的局限和痛点,提出金融科技的创新解决手段,同时指出金融科技可能给商业银行带来的新风险,最后提出商业银行风险管理转型的策略建议。",2018-04-26
金融科技背景下金融外包人才需求趋势,吴欣颀;,苏州工业园区服务外包职业学院;,科教导刊(下旬),科技金融;;金融外包;;人才需求,"信息技术的快速发展引发金融科技的创新应用,金融科技的发展推动了金融供给侧改革,进而引起金融外包业务和金融外包行业所需人才出现新的特点,本文主要研究了金融科技带来的金融外包所需人才的新趋势,并对金融外包人才培养提出了合理化的建议。",2018-04-25
金融科技发展试点“监管沙盒”新模式的必要性及政策建议,李雪静;,上海立信会计金融学院;,上海立信会计金融学院学报,金融监管;;金融科技;;监管沙盒,"随着大数据、云计算、区块链、人工智能等现代科技的发展,金融创新在现有法律框架中及新型商业模式和业态发展中受到诸多限制,创新与监管的矛盾也越来越突出,""监管沙盒""则是寻求新平衡的全新监管理念。本文通过分析""监管沙盒""的要义及国际经验借鉴,针对中国金融创新实践,有针对性地提出操作建议。",2018-04-20
我国金融科技的就业效应研究,谢姗珊,湖南大学,湖南大学,金融科技;;就业;;智能化替代;;异质性劳动力,"区块链、大数据、人工智能、云计算等现代科技与金融深度融合,深刻改变现有金融格局,众多金融业务被智能机器人取代,银行离柜率逐年上升,在给人们生活带来便利的同时,引发金融就业问题。但当前关于金融科技如何影响金融就业以及金融科技对不同金融岗位的影响有何不同等问题尚无定论。系统、深入分析金融科技与金融就业之间的关系,对于促进金融科技充分发挥对经济增长的积极作用和防范金融失业风险等具有极其重要的实践意义。同时,对于丰富就业效应理论也具有重要的意义。本文从金融科技“替代”和“创造”就业的理论分析出发,根据金融科技的“创新”属性创造性地构建了我国金融科技发展指数,并结合2010―2015年中国31个省市的数据进行实证检验,结果显示:金融科技对金融就业的冲击大于创造,且对异质性劳动力的影响不同:对体能型劳动者的替代程度较强,技能型劳动者次之,而对知识型劳动者的需求则有微弱的增加趋势。为防范金融科技带来的失业风险,政府、金融机构、金融人才和金融监管机构都需积极变革:政府应出台政策引导公众正确看待金融科技带来的金融智能化发展模式,金融人才应与时俱进,积极适应智能化转型,金融机构应主动制定长期应对策略和金融监管机构需建立智能化的金融风险监管机制。",2018-04-18
智能投顾的法律规制研究,陆玮炜,华东政法大学,华东政法大学,智能投顾;;法律障碍;;风险分析;;信义义务;;完善建议,"2008年金融危机爆发之后,全球掀起了金融科技(FinTech,Financial Technology合并后的缩写)风潮,金融领域各类新技术呈现爆发式发展,比如大数据、人工智能、区块链、分布式账户,这些新技术与金融的结合,创造出新的金融消费模式,颠覆了传统的金融体系。这也给发展中国家带来契机,相较于金融产业成熟的发达国家,发展中国家和地区的金融体系、商业模式、消费者习惯更容易调整和改变。中国也成为金融科技浪潮中的重要参与者,产生了蚂蚁金服、趣店、微众银行、马上消费金融等一批领先的金融科技公司。在金融科技创新各领域中,智能投资顾问(Robo-advisor,以下简称“智能投顾”)正成为最具发展前景的领域之一。顾名思义,智能投顾就是人工智能技术与传统证券投资顾问的结合,用人工智能技术代替传统人力顾问的方式,通过算法为客户提供投资建议和资产管理服务。智能投顾源起于美国,一方面金融危机使公众对传统金融机构产生信任危机,另一方面大数据、人工智能技术快速发展,出现了以Betterment和Wealthfront为代表的智能投顾公司。除了美国,其他国家的智能投顾行业也迅速兴起,如英国的Nutmeg公司、澳大利亚的Stockspot公司、德国的ginmon(锦萌)公司,在中国也出现了很多参与者,如弥财、理财魔方、投米RA、摩羯智投等。虽然智能投顾有着门槛低、收费低、不受情绪影响等优点,但也存在着自动化带来的特殊风险:一是自身的技术风险,包括内部的算法缺陷、外部的网络风险以及操作风险的问题;二是扩大了市场风险,包括引入高风险客户、强化“羊群效应”和市场共振、增加机构之间的关联性;三是产生了新的法律风险,包括运行智能化对信义义务的挑战和算法专业性对监管手段的挑战。智能投顾的这些风险引起了监管者的关注,各国监管部门对智能投顾纷纷采取了更有针对性的监管行动。美国证券交易委员会(the U.S.Securities and Exchange Commission)发布了关于智能投顾的《指引更新》(IM Guidance Update),指出智能投顾作为注册投资顾问受《1940年投资顾问法》的受托责任和其他实质要求的约束。澳大利亚证券投资委员会(Australian Securities and Investments Commission)发布了《向个人客户提供数字化金融产品建议的监管指南》(Regulatory Guide 255:Providing Digital Financial Product Advice to Retail Clients)。英国金融行为监管局(Financial Conduct Authority)设立了咨询中心(Advice Unit)为智能投顾公司提供单独的监管反馈和通用的监管指导。我国证监会也关注到了智能投顾的监管问题,但是对智能投顾的性质和监管要求仍未明确,国内的智能投顾业务面临很大的政策风险。第一个问题是智能投顾的性质,面临投资顾问、销售辅助、资产管理三个不同的方向;第二个问题是我国的投资顾问业务禁止代理委托人投资,导致智能投顾无法发挥核心的账户管理功能。为了国内智能投顾的健康有序发展,首先,应当破除国内制度障碍,对智能投顾平台实行穿透式审查,根据业务本质明确平台属性。其次,通过金融试点的方式逐渐放开投资顾问的账户管理业务,运用监管科技提高监管能力。再次,明确智能投顾的信义义务要求并建立信息披露制度,保障投资者知情权、维护投资者利益。最后,应当加强投资者教育,提高投资者的自我保护能力。",2018-04-15
