留言主题,clean_review,cut_review,地区,主谓宾
A市潮宗御苑A座的米奇妙妙儿童摄影卷款跑路了,A市潮宗御苑A座的米奇妙妙儿童摄影卷款跑路了,市潮宗 御苑 A座 米 奇妙 妙 儿童 摄影 卷款 跑 路,A市,"潮宗御苑路,（副词：卷款）"
咨询A市缴纳社保及购房等问题,咨询A市缴纳社保及购房等问题,咨询 市 缴纳 社保 购房,A市,"问题A市,（副词：）"
建议A市住房建设管理部门规范房损鉴定行业鉴定规范和标准,建议A市住房建设管理部门规范房损鉴定行业鉴定规范和标准,建议 市 住房 建设 管理 部门 规范 房损 鉴定 行业 鉴定 规范 标准,A市,"部门建议规范,（副词：）"
A市楚行一卡通app退款迟迟未到账,A市楚行一卡通app退款迟迟未到账,市楚行 一卡通 app 退款 迟迟 未到 账,A市,"退款未到账,（副词：迟迟）"
咨询A市对残疾人有什么扶持政策？,咨询A市对残疾人有什么扶持政策,咨询 市 残疾人 扶持 政策,A市,"残疾人咨询A市,（副词：对）"
咨询A市转业士官异地安置问题,咨询A市转业士官异地安置问题,咨询 市 转业 士官 异地 安置,A市,"咨询问题,（副词：）"
投诉A市伊景园滨河苑定向限价商品房违规涨价,投诉A市伊景园滨河苑定向限价商品房违规涨价,投诉 市伊 景园 滨河 苑 定向 限价 商品房 违规 涨价,A市,"商品房投诉违规,（副词：）"
A市人社局是否有职业培训的项目？,A市人社局是否有职业培训的项目,市人 社局 职业培训 项目,A市,"社局有职业培训,（副词：是否）"
投诉A市东盈商业广场房子土地年限缩水，公摊过大,投诉A市东盈商业广场房子土地年限缩水公摊过大,投诉 市东盈 商业广场 房子 土地 年限 缩水 公 摊过,A市,"年限投诉缩水,（副词：）"
请问A市南二环往绕城高速一带有没有新的规划以及轨道交通？,请问A市南二环往绕城高速一带有没有新的规划以及轨道交通,请问 市 南二环 绕城 高速 一带 有没有 新 规划 轨道交通,A市,"南二环请问有没有,（副词：往）"
A市702公交车始发站在圭塘河站乱停放,A市702公交车始发站在圭塘河站乱停放,市 702 公交车 始发站 圭 塘 河站 乱 停放,A市,"始发站停放河站,（副词：在）"
投诉A市伊景园滨河苑定向限价商品房违规涨价,投诉A市伊景园滨河苑定向限价商品房违规涨价,投诉 市伊 景园 滨河 苑 定向 限价 商品房 违规 涨价,A市,"商品房投诉违规,（副词：）"
A市市政建设开发有限公司对广铁职工住宅项目的操作合法吗？,A市市政建设开发有限公司对广铁职工住宅项目的操作合法吗,市 市政建设 开发 有限公司 广铁 职工 住宅 项目 操作 合法,A市,"有限公司合法项目,（副词：对）"
为何我的A市人才购房补贴申请不通过？,为何我的A市人才购房补贴申请不通过,市 人才 购房 补贴 申请,A市,"补贴申请,（副词：为何）"
夫妻共同买的房为何申请A市人才购房补贴不通过？,夫妻共同买的房为何申请A市人才购房补贴不通过,夫妻 买 房 申请 市 人才 购房 补贴,A市,"夫妻申请补贴,（副词：共同）"
A市A3区杜鹃路奥克斯缔壹城违规违建何时拆除？,A市A3区杜鹃路奥克斯缔壹城违规违建何时拆除,市 A3 区 杜鹃 路 奥克斯 缔壹城 违规 违建 拆除,A市,"奥克斯缔壹城,（副词：何时）"
建议对A市远大路和八一路规划实施快捷快速化改造,建议对A市远大路和八一路规划实施快捷快速化改造,建议 市 远大路 一路 规划 实施 快捷 快速化 改造,A市,"远大路建议实施,（副词：对）"
A市阳光城檀悦工地长期通宵施工扰民,A市阳光城檀悦工地长期通宵施工扰民,市 阳光城 檀悦 工地 长期 通宵 施工 扰民,A市,"工地施工,（副词：长期）"
A市半山壹号五次延期交房了,A市半山壹号五次延期交房了,市 半山 壹号 五次 延期 交房,A市,"五次延期交房,（副词：）"
A市高新区公安局旁一工地深夜浇筑混凝土，噪音非常大,A市高新区公安局旁一工地深夜浇筑混凝土噪音非常大,市 高新区 公安局 旁一 工地 深夜 浇筑 混凝土 噪音,A市,"噪音大,（副词：非常）"
投诉A市鹏鑫置业公司拖欠工程款！,投诉A市鹏鑫置业公司拖欠工程款,投诉 市鹏鑫 置业 公司 拖欠 工程款,A市,"公司投诉拖欠,（副词：）"
咨询A市住房公积金贷款问题,咨询A市住房公积金贷款问题,咨询 市 住房 公积金 贷款,A市,"咨询贷款,（副词：）"
A市公交车273的线路怎么改了？,A市公交车273的线路怎么改了,市 公交车 273 线路 改了,A市,"线路改了,（副词：怎么）"
咨询A市办理社保卡问题,咨询A市办理社保卡问题,咨询 市 办理 社保卡,A市,"咨询A市,（副词：）"
A市黄花机场附近新楼盘“和泓桃李春风”规划合理吗,A市黄花机场附近新楼盘和泓桃李春风规划合理吗,市 黄花 机场 新 楼盘 泓 桃李春风 规划,A市,"楼盘规划,（副词：）"
A市物流学院以东的那块空地规划建的公园什么时候开始动工？,A市物流学院以东的那块空地规划建的公园什么时候开始动工,市 物流 学院 以东 那块 空地 规划 建 公园 动工,A市,"空地开始动工,（副词：时候）"
A市江山帝景新房有严重安全隐患,A市江山帝景新房有严重安全隐患,市 江山 帝景 新房 安全隐患,A市,"新房有安全隐患,（副词：）"
A市江山帝景新房有严重安全隐患,A市江山帝景新房有严重安全隐患,市 江山 帝景 新房 安全隐患,A市,"新房有安全隐患,（副词：）"
A市江山帝景新房有严重安全隐患,A市江山帝景新房有严重安全隐患,市 江山 帝景 新房 安全隐患,A市,"新房有安全隐患,（副词：）"
A市人才认证租房补贴通过名单在哪里查看？,A市人才认证租房补贴通过名单在哪里查看,市 人才 认证 租房 补贴 名单 查看,A市,"补贴查看名单,（副词：通过）"
关于高级技师申报A市人才新政购房补贴的相关问题咨询,关于高级技师申报A市人才新政购房补贴的相关问题咨询,高级技师 申报 市 人才 新政 购房 补贴 相关 咨询,A市,"高级技师咨询补贴,（副词：关于）"
A市（骧龙）井湾子机动车检测站乱收费,A市骧龙井湾子机动车检测站乱收费,市骧 龙井 湾子 机动车 检测站 乱收费,A市,"A市骧乱收费,（副词：）"
A市A2区先锋街道大托路碧云路口红绿灯故障,A市A2区先锋街道大托路碧云路口红绿灯故障,市 A2 区 先锋 街道 大托路 碧云 路口 红绿灯 故障,A市,"故障,（副词：）"
A市窑岭西村巷改自来水表的问题盼解决,A市窑岭西村巷改自来水表的问题盼解决,市窑岭 西村 巷改 自来水 表 盼 解决,A市,"西村盼表,（副词：）"
恳请帮忙解决A市A3区西地省鸟玄科技有限公司拖欠员工薪资问题,恳请帮忙解决A市A3区西地省鸟玄科技有限公司拖欠员工薪资问题,恳请 帮忙 解决 市 A3 区西 地省 鸟 玄 科技 有限公司 拖欠 员工 薪资,A市,"有限公司恳请帮忙,（副词：）"
对A市居民在网上办理居住证的疑问,对A市居民在网上办理居住证的疑问,市 居民 网上 办理 居住证 疑问,A市,"居民疑问居住证,（副词：对）"
对A市地铁违规用工问题的质疑,对A市地铁违规用工问题的质疑,市 地铁 违规 用工 质疑,A市,"问题质疑问题,（副词：）"
A市医学院的学费价格为何会比其他学校高出五六倍？,A市医学院的学费价格为何会比其他学校高出五六倍,市 医学院 学费 价格 学校 高出 五六倍,A市,"价格高出五六倍,（副词：为何）"
A市A6区东马小区A区店面长期占用划线停车位,A市A6区东马小区A区店面长期占用划线停车位,市 A6 区 东马 小区 区 店面 长期 占用 划线 停车位,A市,"店面占用停车位,（副词：长期）"
A市北辰三角洲c2区3栋02户型和04户型入户门设计不合理,A市北辰三角洲c2区3栋02户型和04户型入户门设计不合理,市 北辰 三角洲 c2 区 栋 02 户型 04 户型 入户门 设计 不合理,A市,"区不合理,（副词：）"
咨询A市新引进高级技师人才奖励政策相关问题,咨询A市新引进高级技师人才奖励政策相关问题,咨询 市新 引进 高级技师 人才 奖励 政策 相关,A市,"咨询A市,（副词：新）"
关于A市最新版养犬条例部分内容的咨询,关于A市最新版养犬条例部分内容的咨询,市 最新版 养犬 条例 内容 咨询,A市,"最新版咨询最新版,（副词：关于）"
C市到A市会开通地铁吗？,C市到A市会开通地铁吗,C 市到 市会 开通 地铁,A市,"C开通A市,（副词：会）"
A市远鑫尚细时隐瞒垃圾站距离居民区很近,A市远鑫尚细时隐瞒垃圾站距离居民区很近,市远鑫 尚细时 隐瞒 垃圾站 距离 居民区 很近,A市,"远鑫隐瞒很近,（副词：尚细时）"
A市人才新政的补贴已经快两个月没发了,A市人才新政的补贴已经快两个月没发了,市 人才 新政 补贴 两个 没发,A市,"补贴没发,（副词：已经）"
建议A市修复西地省和平解放条文签定地，打造红色旅游名片,建议A市修复西地省和平解放条文签定地打造红色旅游名片,建议 市 修复 西地省 和平 解放 条文 签定 打造 红色旅游 名片,A市,"A市建议修复,（副词：签定）"
A市A1区凯通国际城消防设施严重瘫痪，区政府承诺解决至今仍无果,A市A1区凯通国际城消防设施严重瘫痪区政府承诺解决至今仍无果,市 A1 区凯通 国际 城 消防设施 瘫痪 区政府 承诺 解决 无果,A市,"区政府承诺无果,（副词：至今）"
A市A4区沙坪街道汉回村支书纵容华颖实业集团侵占农民山林,A市A4区沙坪街道汉回村支书纵容华颖实业集团侵占农民山林,市 A4 区 沙坪 街道 汉回 村支书 纵容 华颖 实业集团 侵占 农民 山林,A市,"村支书纵容山林,（副词：）"
关于A市钰龙天下小区业主大会违规操纵投票的反馈,关于A市钰龙天下小区业主大会违规操纵投票的反馈,市钰龙 天下 小区业主 大会 违规 操纵 投票 反馈,A市,"大会反馈操纵,（副词：违规）"
关于A市土地确权和粮田直补金问题的咨询,关于A市土地确权和粮田直补金问题的咨询,市 土地 确权 粮田 直补金 咨询,A市,"确权咨询确权,（副词：）"
恳请A市经侦公正办理58车贷案件，还我们受害人一个公道,恳请A市经侦公正办理58车贷案件还我们受害人一个公道,恳请 市 经侦 公正 办理 58 车贷 案件 受害人 公道,A市,"经侦恳请办理,（副词：公正）"
A市倾城小区没有规划人行道，导致行人常年走马路中间,A市倾城小区没有规划人行道导致行人常年走马路中间,市 倾城 小区 规划 人行道 导致 行人 常年 走 马路,A市,"小区规划人行道,（副词：没有）"
A市星沙中茂城恶意拖欠血汗钱，拒不退款,A市星沙中茂城恶意拖欠血汗钱拒不退款,市星沙 中茂城 恶意 拖欠 血汗钱 拒 退款,A市,"中茂城拖欠血汗钱,（副词：恶意）"
请问A市加快国家中心城市建设有何具体行动？,请问A市加快国家中心城市建设有何具体行动,请问 市 加快 国家 中心 城市 建设 有何,A市,"A市请问加快,（副词：）"
A市红星农博小区水改之后经常没通知就停水,A市红星农博小区水改之后经常没通知就停水,市 红星 农博 小区 水改 通知 停水,A市,"通知停水,（副词：之后）"
社保补缴后，A市人才新政补贴会补发吗,社保补缴后A市人才新政补贴会补发吗,社保 补缴 市 人才 新政 补贴 补发,A市,"社保补发,（副词：后）"
A市人才新政补贴最近两个月的怎么还没发？,A市人才新政补贴最近两个月的怎么还没发,市 人才 新政 补贴 两个 没发,A市,"补贴没发,（副词：怎么）"
A市民可以在网上办理无犯罪记录证明吗？,A市民可以在网上办理无犯罪记录证明吗,市民 网上 办理 犯罪 记录 证明,A市,"民办理犯罪,（副词：可以）"
建议A市新建劳动路下穿曙光路通道,建议A市新建劳动路下穿曙光路通道,建议 市 新建 劳动 路下 穿 曙光路 通道,A市,"A市建议新建,（副词：）"
请解决A市星沙城建设第一批拆迁户的生产安置预留用地及养老保险问题,请解决A市星沙城建设第一批拆迁户的生产安置预留用地及养老保险问题,请 解决 市星 沙城 建设 第一批 拆迁户 生产 安置 预留 用地 养老保险,A市,"沙城请解决,（副词：）"
咨询A市直系亲属之间赠与商品房的相关问题,咨询A市直系亲属之间赠与商品房的相关问题,咨询 市 直系亲属 之间 赠与 商品房 相关,A市,"之间问题直系亲属,（副词：）"
A市高新技术企业遭敲诈勒索，公安局办事拖拉,A市高新技术企业遭敲诈勒索公安局办事拖拉,市 高新技术 企业 遭 敲诈勒索 公安局 办事 拖拉,A市,"企业遭办事,（副词：）"
关于《A市人才购房及购房补贴实施办法（试行）》相关问题的咨询,关于A市人才购房及购房补贴实施办法试行相关问题的咨询,市 人才 购房 购房 补贴 实施办法 试行 相关 咨询,A市,"人才咨询问题,（副词：）"
实名举报A市楚雅二医院鉴定中心作虚假鉴定,实名举报A市楚雅二医院鉴定中心作虚假鉴定,实名 举报 市楚 雅二 医院 鉴定中心 作 虚假 鉴定,A市,"实名举报鉴定中心,（副词：）"
A市南郡明珠业主8年了都没有房产证,A市南郡明珠业主8年了都没有房产证,市 南郡 明珠 业主 年 房产证,A市,"业主没有房产证,（副词：年）"
A市A1区路和五一大道交叉口无红绿灯，人车混流现象严重,A市A1区路和五一大道交叉口无红绿灯人车混流现象严重,市 A1 区路 五一 大道 交叉口 红绿灯 人车 混流 现象,A市,"路严重人车,（副词：）"
A市聚利网诈骗，派出所立案已超3个月依然毫无进展,A市聚利网诈骗派出所立案已超3个月依然毫无进展,市聚利网 诈骗 派出所 立案 已超 依然 进展,A市,"派出所立案进展,（副词：依然）"
A市金科天悦的车位价格合理吗,A市金科天悦的车位价格合理吗,市 金科 天悦 车位 价格合理,A市,"价格合理,（副词：）"
A市麦芒国际业主担心教育问题,A市麦芒国际业主担心教育问题,市 麦芒 国际 业主 担心 教育,A市,"业主担心问题,（副词：）"
举报买卖驾照分源头企业A市站易通盈网络科技有限公司,举报买卖驾照分源头企业A市站易通盈网络科技有限公司,举报 买卖 驾照 分 源头 企业 市站 易 通盈 网络科技 有限公司,A市,"驾照举报A市,（副词：）"
投诉A市伊景园滨河苑捆绑销售车位,投诉A市伊景园滨河苑捆绑销售车位,投诉 市伊 景园 滨河 苑 捆绑 销售 车位,A市,"苑投诉车位,（副词：）"
对A市A4区委员会办公室回复不属实的质疑,对A市A4区委员会办公室回复不属实的质疑,市 A4 区 委员会 办公室 回复 属实 质疑,A市,"回复质疑办公室,（副词：对）"
A市桔园小区拿铁空间物业不负责,A市桔园小区拿铁空间物业不负责,市 桔园 小区 铁 空间 物业 负责,A市,"小区拿物业,（副词：不）"
A市山水湾小区经常有粪池车停在里面,A市山水湾小区经常有粪池车停在里面,市 山水 湾 小区 粪池 车停,A市,"小区有在,（副词：经常）"
投诉A市大汉汉园项目欺骗消费者,投诉A市大汉汉园项目欺骗消费者,投诉 市 大汉 汉园 项目 欺骗 消费者,A市,"项目投诉消费者,（副词：）"
建议A市加快国际金融中心建设,建议A市加快国际金融中心建设,建议 市 加快 国际 金融中心 建设,A市,"A市建议加快,（副词：）"
A市A1区文艺新村社区公共停车区域被一业主强占做生意,A市A1区文艺新村社区公共停车区域被一业主强占做生意,市 A1 区 文艺 新村 社区 公共 停车 区域 业主 强占 做生意,A市,"业主强占做生意,（副词：被）"
对A市A1区南路快速化改造工程的意见,对A市A1区南路快速化改造工程的意见,市 A1 区 南路 快速化 改造 工程 意见,A市,"工程意见工程,（副词：）"
夏天到了，请求A市相关部门告知蚊虫防治方法,夏天到了请求A市相关部门告知蚊虫防治方法,夏天 请求 市 相关 部门 告知 蚊虫 防治 方法,A市,"到告知,（副词：夏天）"
A市渣土办在A1区新安村倾倒渣土，有审批手续没,A市渣土办在A1区新安村倾倒渣土有审批手续没,市 渣土 办 A1 区 新安 村 倾倒 渣土 审批 手续,A市,"渣土办渣土,（副词：）"
A市公安局协管员工资低无福利,A市公安局协管员工资低无福利,市 公安局 协管员 工资 低 福利,A市,"工资低福利,（副词：）"
请求把A市恒达时代花园小区消防通道纳入提质改造,请求把A市恒达时代花园小区消防通道纳入提质改造,请求 市恒达 时代 花园 小区 消防通道 纳入 提质 改造,A市,"消防通道请求纳入,（副词：把）"
咨询A市圣毅园项目的出路,咨询A市圣毅园项目的出路,咨询 市圣毅园 项目 出路,A市,"出路项目,（副词：）"
A市所有协管员的心声！,A市所有协管员的心声,市 协管员 心声,A市,"心声,（副词：）"
请加快A市国际消费中心城市创建,请加快A市国际消费中心城市创建,请 加快 市 国际 消费 中心 城市 创建,A市,"请加快,（副词：）"
请问A市A5区针对红星片区的开发项目目前进展情况如何？,请问A市A5区针对红星片区的开发项目目前进展情况如何,请问 市 A5 区 红星 片区 开发 项目 进展 情况,A市,"A5区请问如何,（副词：针对）"
A市新奥燃气服务态度差,A市新奥燃气服务态度差,市新奥 燃气 服务态度 差,A市,"服务态度差,（副词：）"
希望A市A4区政府尽快查处北辰三角洲c2区群租房现象,希望A市A4区政府尽快查处北辰三角洲c2区群租房现象,希望 市 A4 区政府 查处 北辰 三角洲 c2 区群 租房 现象,A市,"政府希望查处,（副词：尽快）"
请A市加快世界旅游度假区发展步伐,请A市加快世界旅游度假区发展步伐,请 市 加快 世界 旅游 度假区 发展 步伐,A市,"度假区请加快,（副词：）"
A市高运小区里有人办丧，扰民,A市高运小区里有人办丧扰民,市高运 小区 里 有人 办丧 扰民,A市,"有人办丧扰民,（副词：里）"
A市中建信和地产给小区配备的幼儿园学位和小学远远不能满足要求,A市中建信和地产给小区配备的幼儿园学位和小学远远不能满足要求,市 中建 信 地产 小区 配备 幼儿园 学位 小学 远远 满足要求,A市,"信满足要求小区,（副词：给）"
A市A6区才子城开发商公然恐吓业主,A市A6区才子城开发商公然恐吓业主,市 A6 区 才子 城 开发商 恐吓 业主,A市,"开发商恐吓业主,（副词：公然）"
坚决取缔杜绝A市在住宅小区居民住宅楼里开设麻将馆扰民之事,坚决取缔杜绝A市在住宅小区居民住宅楼里开设麻将馆扰民之事,取缔 杜绝 市 住宅小区 居民 住宅楼 里 开设 麻将馆 扰民 事,A市,"A市取缔开设,（副词：坚决）"
A市地铁二号线满车贴苏宁的广告纸，气味刺鼻,A市地铁二号线满车贴苏宁的广告纸气味刺鼻,市 地铁 二号线 满车 贴 苏宁 广告 纸 气味 刺鼻,A市,"满车贴气味,（副词：）"
A市805路公交车能不能改道走木莲中路,A市805路公交车能不能改道走木莲中路,市 805 路 公交车 改道 走 木莲 中路,A市,"公交车改道中路,（副词：能）"
A市地铁一号线北延线什么时候开工,A市地铁一号线北延线什么时候开工,市 地铁 一号线 北延线 开工,A市,"开工,（副词：时候）"
A市庆和里路、太平路的问题何时能解决，投诉好多次了,A市庆和里路太平路的问题何时能解决投诉好多次了,市庆 里 路 太平路 何时能 解决 投诉,A市,"问题解决,（副词：何时能）"
A市加快招商引资方面有何具体行动？,A市加快招商引资方面有何具体行动,市 加快 招商引资 有何,A市,"A市加快行动,（副词：）"
A市梅溪正荣府停工半年，面临烂尾风险,A市梅溪正荣府停工半年面临烂尾风险,市梅溪 正荣府 停工 半年 面临 烂尾 风险,A市,"正荣府停工风险,（副词：半年）"
恳请A市政府帮我追回被卷钱款,恳请A市政府帮我追回被卷钱款,恳请 市政府 帮 追回 卷 钱款,A市,"恳请帮,（副词：被）"
A市三一大道省高管局至对面海底世界应设置人行天桥,A市三一大道省高管局至对面海底世界应设置人行天桥,市三一 大道 省高 管局 对面 海底 世界 应 设置 人行天桥,A市,"管局设置人行天桥,（副词：至）"
咨询A市事业单位考试报名中职业资格与职称比照对应的问题,咨询A市事业单位考试报名中职业资格与职称比照对应的问题,咨询 市 事业单位 考试 报名 中 职业资格 职称,A市,"职业资格问题对应,（副词：与）"
A市水岸天际小区附近施工扰民,A市水岸天际小区附近施工扰民,市 水岸 天际 小区 施工 扰民,A市,"施工,（副词：附近）"
举报A市A4区捞刀河街道高源村村长欺负村民,举报A市A4区捞刀河街道高源村村长欺负村民,举报 市 A4 区 捞刀河 街道 高源村 村长 欺负 村民,A市,"村长举报欺负,（副词：）"
A市天润花园小区楼下凉菜店经营到很晚，很吵,A市天润花园小区楼下凉菜店经营到很晚很吵,市天润 花园 小区 楼下 凉菜 店 经营 晚 吵,A市,"店经营,（副词：到）"
请问非电力局的人能否在A市电力局的体育馆内打球？,请问非电力局的人能否在A市电力局的体育馆内打球,请问 非 电力局 市 电力局 体育馆 打球,A市,"人请问打球,（副词：能否）"
A市A5区明昇壹城小区越凯物业聘用无证保安人员,A市A5区明昇壹城小区越凯物业聘用无证保安人员,市 A5 区明 昇 壹城 小区 越凯 物业 聘用 无证 保安人员,A市,"A5区昇聘用,（副词：明）"
建议加快A市食品药品安全整治全覆盖,建议加快A市食品药品安全整治全覆盖,建议 加快 市 食品药品 整治 全 覆盖,A市,"食品药品建议加快,（副词：安全）"
A市凯达园小区修路，噪音扰民,A市凯达园小区修路噪音扰民,市凯 达园 小区 修路 噪音 扰民,A市,"小区修路噪音,（副词：）"
A市洪山公园什么时候会动工？,A市洪山公园什么时候会动工,市 洪山 公园 动工,A市,"动工,（副词：时候）"
A市华坤时代写字楼的金融投资骗局太多了，请严查！,A市华坤时代写字楼的金融投资骗局太多了请严查,市 华坤 时代 写字楼 金融 投资 骗局 太多 请 严查,A市,"太多请严查,（副词：）"
A市鑫苑木莲世家涉嫌虚假宣传，偷工减料,A市鑫苑木莲世家涉嫌虚假宣传偷工减料,市鑫苑 木莲 世家 涉嫌 虚假 宣传 偷工减料,A市,"世家涉嫌宣传,（副词：虚假）"
A市投蜂金融服务公司诈骗百姓1.9亿不还,A市投蜂金融服务公司诈骗百姓19亿不还,市 投蜂 金融服务 公司 诈骗 百姓 19 亿,A市,"公司诈骗,（副词：不）"
M市基层工作人员住房公积金非正常缴纳，导致在A市买房无法贷款,M市基层工作人员住房公积金非正常缴纳导致在A市买房无法贷款,M 市 基层 工作人员 住房 公积金 非正常 缴纳 导致 市 买房 贷款,A市,"缴纳导致买房,（副词：在）"
A市华嘉城小区精装房墙壁有鼓包,A市华嘉城小区精装房墙壁有鼓包,市华嘉城 小区 精装 房 墙壁 鼓包,A市,"墙壁有鼓包,（副词：）"
A市润华燃气迟迟不给A6区新城国际花都四期业主开通燃气,A市润华燃气迟迟不给A6区新城国际花都四期业主开通燃气,市润华 燃气 迟迟 A6 区 新城 国际 花都 四期 业主 开通 燃气,A市,"燃气开通燃气,（副词：迟迟）"
请公开A市阳光100房屋竣工验收备案表,请公开A市阳光100房屋竣工验收备案表,请 公开 市 阳光 100 房屋 竣工 验收 备案 表,A市,"请公开,（副词：）"
反映A市A5区劳动东路昇明壹城小区内消防安全问题,反映A市A5区劳动东路昇明壹城小区内消防安全问题,市 A5 区 劳动 东路 昇 明壹城 区内 消防安全,A市,"反映问题,（副词：）"
A市身份证到期能否网上换证？,A市身份证到期能否网上换证,市 身份证 到期 网上 换证,A市,"身份证到期,（副词：能否）"
建议A市黄花机场公交车推迟下班,建议A市黄花机场公交车推迟下班,建议 市 黄花 机场 公交车 推迟 下班,A市,"公交车建议推迟,（副词：）"
A市雅居乐花园房屋外墙有渗水问题,A市雅居乐花园房屋外墙有渗水问题,市雅居乐 花园 房屋 外墙 渗水,A市,"外墙有问题,（副词：）"
A市梅溪湖嘉顺苑安置小区房屋质量差,A市梅溪湖嘉顺苑安置小区房屋质量差,市梅 溪湖 嘉顺苑 安置 小区 房屋 质量 差,A市,"溪湖安置质量,（副词：）"
