留言主题,clean_review,cut_review,地区,主谓宾
A9市关口街道办事处长兴社区在四季花城业主委员会的筹建过程中涉嫌违规,A9市关口街道办事处长兴社区在四季花城业主委员会的筹建过程中涉嫌违规,A9 市 关口 街道 办事处 长兴 社区 四季 花城 业主 委员会 筹建 过程 中 涉嫌 违规,A9市,"社区涉嫌违规,（副词：在）"
反映A9市集里街道办唐家园村新桥组的液化汽检测厂排放废气问题,反映A9市集里街道办唐家园村新桥组的液化汽检测厂排放废气问题,A9 市集 里 街道办 唐 家园 村 新桥 组 液化 汽 检测 厂 排放 废气,A9市,"厂反映废气,（副词：）"
A9市永安供电所强占我田徳多年,A9市永安供电所强占我田徳多年,A9 市 永安 供电所 强占 我田 徳 多年,A9市,"供电所强占我田,（副词：）"
A9市花炮大道禧和学苑烂尾,A9市花炮大道禧和学苑烂尾,A9 市 花炮 大道 禧 学苑 烂尾,A9市,"禧,（副词：）"
蒙华铁路A9市段一季度工程款还未拨付,蒙华铁路A9市段一季度工程款还未拨付,蒙华 铁路 A9 市段 一季度 工程款 未 拨付,A9市,"工程款拨付,（副词：还）"
反映长郡A9市实验学校特长生招生名不符实的问题,反映长郡A9市实验学校特长生招生名不符实的问题,长郡 A9 市 实验学校 特长生 招生 名不符实,A9市,"特长生反映问题,（副词：）"
A9市淮川街道税务中心机构解散，人员分流面临失业,A9市淮川街道税务中心机构解散人员分流面临失业,A9 市淮川 街道 税务 中心 机构 解散 人员 分流 面临 失业,A9市,"人员分流失业,（副词：）"
A9市古港镇宝盖村土地被占无证建房经营，举报三年未解决,A9市古港镇宝盖村土地被占无证建房经营举报三年未解决,A9 市古港 镇 宝盖 村 土地 占 无证 建房 经营 举报 三年 未 解决,A9市,"占土地,（副词：被）"
请彻查A9市北盛镇卓然村的账目！,请彻查A9市北盛镇卓然村的账目,请 彻查 A9 市北 盛镇 卓然 村 账目,A9市,"请彻查,（副词：）"
蒙华铁路A9市段中铁十五局二工区施工队拖欠农民工工资,蒙华铁路A9市段中铁十五局二工区施工队拖欠农民工工资,蒙华 铁路 A9 市段 中铁 十五 局二 工区 施工队 拖欠 农民工 工资,A9市,"施工队拖欠工资,（副词：）"
咨询A9市收养孩子的上户问题,咨询A9市收养孩子的上户问题,咨询 A9 市 收养 孩子 上户,A9市,"市咨询孩子,（副词：）"
A9市到A市的319路太烂了，建议修一下,A9市到A市的319路太烂了建议修一下,A9 市到 市 319 路 太烂 建议 修,A9市,"A9太烂A市,（副词：）"
等A市208路公交等了40分钟,等A市208路公交等了40分钟,市 208 路 公交 40 分钟,A市,"公交等A市,（副词：）"
A市205路公交车经常不按时发车,A市205路公交车经常不按时发车,市 205 路 公交车 发车,A市,"公交车发车,（副词：经常）"
A市地铁三号线文体中心站开元路南出入口何时施工,A市地铁三号线文体中心站开元路南出入口何时施工,市 地铁 三号 线 文体 中心站 开元 路南 出入口 施工,A市,"出入口施工,（副词：何时）"
再次反映A市金茂府一房二卖问题,再次反映A市金茂府一房二卖问题,市金茂府 一房 二卖,A市,"反映问题,（副词：再次）"
A市万科金域蓝湾烟道严重影响居民生活,A市万科金域蓝湾烟道严重影响居民生活,市 万科 金域 蓝湾 烟道 影响 居民 生活,A市,"烟道影响生活,（副词：严重）"
A市万科魅力之城近百户房屋楼板、墙面开裂！,A市万科魅力之城近百户房屋楼板墙面开裂,市 万科 魅力 之城近 百户 房屋 楼板 墙面 开裂,A市,"墙面开裂,（副词：之城近）"
强烈建议将地铁7号线南延至A市生态动物园,强烈建议将地铁7号线南延至A市生态动物园,强烈建议 地铁 号线 南 延至 市 生态 动物园,A市,"强烈建议延至,（副词：将）"
再次投诉A市北大资源理想家园违规租售车位,再次投诉A市北大资源理想家园违规租售车位,投诉 市 北大 资源 理想 家园 违规 租售 车位,A市,"投诉车位,（副词：再次）"
咨询A市住房资格的相关问题,咨询A市住房资格的相关问题,咨询 市 住房 资格 相关,A市,"问题资格,（副词：）"
咨询A市军转安置问题,咨询A市军转安置问题,咨询 市 军转 安置,A市,"咨询问题,（副词：）"
A市西文庙一带还有两大安全隐患需改善,A市西文庙一带还有两大安全隐患需改善,市西 文庙 一带 两大 安全隐患 需 改善,A市,"一带还有改善,（副词：需）"
A市梅溪湖安置房质量差，威胁人身安全,A市梅溪湖安置房质量差威胁人身安全,市梅 溪湖 安置 房 质量 差 威胁 人身安全,A市,"溪湖安置人身安全,（副词：差）"
强烈建议将地铁7号线南延至A市生态动物园,强烈建议将地铁7号线南延至A市生态动物园,强烈建议 地铁 号线 南 延至 市 生态 动物园,A市,"强烈建议延至,（副词：将）"
A市中院中央空调噪声扰民,A市中院中央空调噪声扰民,市 中院 中央空调 噪声 扰民,A市,"噪声扰民,（副词：）"
A市万科魅力之城小区近百户楼板开裂墙面开裂,A市万科魅力之城小区近百户楼板开裂墙面开裂,市 万科 魅力 城 小区 百户 楼板 开裂 墙面 开裂,A市,"楼板开裂,（副词：）"
咨询A市调整用电基数问题,咨询A市调整用电基数问题,咨询 市 调整 用电 基数,A市,"A市咨询问题,（副词：）"
A市的猪肉价格太高了,A市的猪肉价格太高了,市 猪肉 价格 太高,A市,"价格太高,（副词：）"
请问A市直遴选能否参照国家公务员遴选,请问A市直遴选能否参照国家公务员遴选,请问 市直 遴选 参照 国家 公务员 遴选,A市,"A市请问遴选,（副词：直）"
建议A市地铁7号线在远大路A9市河大桥两岸设站,建议A市地铁7号线在远大路A9市河大桥两岸设站,建议 市 地铁 号线 远大路 A9 市 河大桥 两岸 设 站,A市,"7号线建议设,（副词：在）"
A市雄新华府存在安全隐患,A市雄新华府存在安全隐患,市雄 新华 府 安全隐患,A市,"府存在安全隐患,（副词：）"
A市高铁东广场垃圾点发出酸臭味严重影响环境,A市高铁东广场垃圾点发出酸臭味严重影响环境,市 高铁 东 广场 垃圾 点 发出 酸 臭味 影响 环境,A市,"点发出影响,（副词：严重）"
A市五一广场地铁站路标不明显,A市五一广场地铁站路标不明显,市 五一广场 地铁站 路标,A市,"路标明显,（副词：不）"
A市金地物业同一小区同种服务两种价格,A市金地物业同一小区同种服务两种价格,市金地 物业 小区 同种 服务 两种 价格,A市,"价格,（副词：）"
请A市加大对P2P平台余易贷的侦查力度,请A市加大对P2P平台余易贷的侦查力度,请 市 加大 P2P 平台 余易贷 侦查 力度,A市,"余易贷请加大,（副词：）"
A市城际铁路小编组列车设置不合理,A市城际铁路小编组列车设置不合理,市 城际 铁路 编组 列车 设置 不合理,A市,"列车设置,（副词：）"
承办A市58车贷案警官应跟进关注留言,承办A市58车贷案警官应跟进关注留言,承办 市 58 车 贷案 警官 应 跟进 关注 留言,A市,"警官跟进留言,（副词：应）"
建议A市经开区双休日和寒暑假开放A7县泉星小学田径场,建议A市经开区双休日和寒暑假开放A7县泉星小学田径场,建议 市经 开区 双休日 寒暑假 开放 A7 县泉星 小学 田径场,A市,"经开区建议开放,（副词：双休日）"
A市福晟兴汝金城二期质量未达标就交房！,A市福晟兴汝金城二期质量未达标就交房,市福晟兴 金城 二期 质量 未达标 交房,A市,"质量交房,（副词：就）"
希望A市能下大力气整治交通乱象行为！,希望A市能下大力气整治交通乱象行为,希望 市能 下大力气 整治 交通 乱象,A市,"A市希望整治,（副词：能）"
A市珠江俪城公园一号31栋103麻将馆扰民不止,A市珠江俪城公园一号31栋103麻将馆扰民不止,市 珠江 俪 城 公园 一号 31 栋 103 麻将馆 扰民,A市,"麻将馆扰民,（副词：）"
A市珠江俪城公园一号31栋103麻将馆扰民不止,A市珠江俪城公园一号31栋103麻将馆扰民不止,市 珠江 俪 城 公园 一号 31 栋 103 麻将馆 扰民,A市,"麻将馆扰民,（副词：）"
A市美联幼儿园什么时候能招生,A市美联幼儿园什么时候能招生,市美联 幼儿园 招生,A市,"招生,（副词：时候）"
反映A市商贸旅游学院白田宿舍摆摊问题,反映A市商贸旅游学院白田宿舍摆摊问题,市 商贸 旅游 学院 白田 宿舍 摆摊,A市,"反映问题,（副词：）"
投诉A市W218路到站不停车,投诉A市W218路到站不停车,投诉 市 W218 路到 站 停车,A市,"站投诉,（副词：不）"
A市205路公交车经常不按时发车,A市205路公交车经常不按时发车,市 205 路 公交车 发车,A市,"公交车发车,（副词：经常）"
A市退休教师教龄补贴到底该不该发,A市退休教师教龄补贴到底该不该发,市 退休 教师 教龄 补贴 该不该 发,A市,"教龄该不该,（副词：到底）"
新买的纯电动封闭式面包车不到1个月被A市交警抓4次,新买的纯电动封闭式面包车不到1个月被A市交警抓4次,新买 电动 封闭式 面包车 不到 市 交警 抓 次,A市,"面包车抓月,（副词：被）"
A市学院拖欠农民工工资三年，校领导答应付款又以没钱为由踢皮球,A市学院拖欠农民工工资三年校领导答应付款又以没钱为由踢皮球,市 学院 拖欠 农民工 工资 三年 校领导 答应 付款 钱 踢皮球,A市,"学院答应工资,（副词：又）"
A市交警为何不认市政红头文件依然抓新能源车辆！！,A市交警为何不认市政红头文件依然抓新能源车辆,市 交警 不认 市政 红头文件 依然 抓 新能源 车辆,A市,"交警不认红头文件,（副词：为何）"
反映人民快速路与A市大道和劳动路衔接问题,反映人民快速路与A市大道和劳动路衔接问题,快速路 市 大道 劳动 路 衔接,A市,"大道反映问题,（副词：）"
A市中级人民法院明显偏袒强势出租方，判决严重不公,A市中级人民法院明显偏袒强势出租方判决严重不公,市 中级 人民法院 偏袒 强势 出租方 判决 不公,A市,"人民法院明显,（副词：）"
A市小学的不正之风该停了,A市小学的不正之风该停了,市 小学 不正之风 停,A市,"不正之风停,（副词：该）"
投诉A市天麓尚层物业私自变更小区规划,投诉A市天麓尚层物业私自变更小区规划,投诉 市天麓 尚层 物业 私自 变更 小区 规划,A市,"物业投诉变更,（副词：私自）"
西地省A市蜂投网涉嫌诈骗,西地省A市蜂投网涉嫌诈骗,西地省 市蜂 投网 涉嫌 诈骗,A市,"投网诈骗,（副词：）"
A市A1区华天楚水源足浴涉黄经营按摩服务,A市A1区华天楚水源足浴涉黄经营按摩服务,市 A1 区 华天 楚 水源 足浴 涉黄 经营 按摩 服务,A市,"水源足浴经营,（副词：）"
A市地铁、磁浮什么时候可以使用扫码乘车码,A市地铁磁浮什么时候可以使用扫码乘车码,市 地铁 磁浮 扫码 乘车 码,A市,"使用扫码,（副词：时候）"
A市发顺驾驶员培训有限公司教练欺诈消费者,A市发顺驾驶员培训有限公司教练欺诈消费者,市发顺 驾驶员 培训 有限公司 教练 欺诈 消费者,A市,"消费者,（副词：）"
请求解决A市楚府高架路隧道东进出口噪声问题,请求解决A市楚府高架路隧道东进出口噪声问题,请求 解决 市楚府 高架路 隧道 东 进出口 噪声,A市,"请求解决,（副词：东）"
请问A市企业要如何办理人力资源服务许可证,请问A市企业要如何办理人力资源服务许可证,请问 市 企业 办理 人力资源 服务 许可证,A市,"企业请问办理,（副词：要）"
A市交通运输局对“公交车乱挤乱插现象”回复失实,A市交通运输局对公交车乱挤乱插现象回复失实,市 交通运输 局对 公交车 乱挤 乱 插 现象 回复 失实,A市,"现象回复公交车,（副词：乱）"
A市地铁六号线人民东路站连续几个星期通宵施工了,A市地铁六号线人民东路站连续几个星期通宵施工了,市 地铁 六号 线 东路 站 连续 几个 星期 通宵 施工,A市,"站施工,（副词：星期）"
A市新华联涉嫌虚假广告欺诈销售,A市新华联涉嫌虚假广告欺诈销售,市 新华联 涉嫌 虚假 广告 欺诈 销售,A市,"新华联涉嫌销售,（副词：）"
投诉A市麓谷小镇物业停车费收取不合理,投诉A市麓谷小镇物业停车费收取不合理,投诉 市麓 谷 小镇 物业 停车费 收取 不合理,A市,"停车费投诉收取,（副词：）"
A市的全装修核价最晚什么时候能出来？,A市的全装修核价最晚什么时候能出来,市 全 装修 核价 晚,A市,"出来,（副词：全）"
在A市金茂悦二期艺棵树培训学校交的学费要不回,在A市金茂悦二期艺棵树培训学校交的学费要不回,市金茂悦 二期 艺棵树 培训 学校 交 学费 回,A市,"学校回学费,（副词：在）"
投诉A市红星国际公馆违规交房现象,投诉A市红星国际公馆违规交房现象,投诉 市 红星 国际 公馆 违规 交房 现象,A市,"投诉现象,（副词：）"
A市楚仪学校门口长期地摊占道经营，堵塞交通,A市楚仪学校门口长期地摊占道经营堵塞交通,市楚仪 学校 门口 长期 地摊 占 道 经营 堵塞 交通,A市,"地摊占道,（副词：）"
A市桂花二村十四栋楼下垃圾站晚上工作太吵,A市桂花二村十四栋楼下垃圾站晚上工作太吵,市 桂花 二村 十四 栋 楼下 垃圾站 晚上 工作 太吵,A市,"太吵,（副词：晚上）"
举报A市中联重科侵占改制企业老职工利益,举报A市中联重科侵占改制企业老职工利益,举报 市 中联重科 侵占 改制 企业 职工 利益,A市,"中联重科举报侵占,（副词：）"
A市邮政局单位宿舍拆迁无房无补助,A市邮政局单位宿舍拆迁无房无补助,市 邮政局 单位 宿舍 拆迁 无房 补助,A市,"无房无补助,（副词：）"
A市万科金域蓝湾商铺烟道装在住户窗口这种做法合理合法吗？,A市万科金域蓝湾商铺烟道装在住户窗口这种做法合理合法吗,市 万科 金域 蓝湾 商铺 烟道 装在 住户 窗口 做法 合理合法,A市,"做法合理合法,（副词：）"
A市理工大学连续查寝影响学生正常生活,A市理工大学连续查寝影响学生正常生活,市 理工大学 连续 查寝 影响 学生 生活,A市,"理工大学影响生活,（副词：连续）"
A市A3区金岭小区内开KTV，怎么回事？,A市A3区金岭小区内开KTV怎么回事,市 A3 区金岭 区内 开 KTV 怎么回事,A市,"区内开怎么回事,（副词：）"
反映A市南雅中学初中秋游问题,反映A市南雅中学初中秋游问题,市南 雅 中学 初中 秋游,A市,"反映问题,（副词：）"
状告A市规划局和奥新燃气公司，被告知超过5年不受理,状告A市规划局和奥新燃气公司被告知超过5年不受理,状告 市 规划局 奥新 燃气公司 告知 超过 年 受理,A市,"状告规划局,（副词：被）"
状告A市规划局和奥新燃气公司，被告知超过5年不受理,状告A市规划局和奥新燃气公司被告知超过5年不受理,状告 市 规划局 奥新 燃气公司 告知 超过 年 受理,A市,"状告规划局,（副词：被）"
A市五江国际商业广场的进展如何了,A市五江国际商业广场的进展如何了,市五江 国际 商业广场 进展,A市,"进展,（副词：）"
在A市科佳电脑城买电脑被骗，两千多的电脑卖五千,在A市科佳电脑城买电脑被骗两千多的电脑卖五千,市科佳 电脑城 买 电脑 骗 两千多 电脑 卖 五千,A市,"电脑城买电脑,（副词：在）"
请问A市集体户口居民办结婚证困难吗？,请问A市集体户口居民办结婚证困难吗,请问 市 集体 户口 居民 办 结婚证 困难,A市,"居民请问结婚证,（副词：）"
A市赤岗岭地铁站晚上工地施工扰民严重,A市赤岗岭地铁站晚上工地施工扰民严重,市 赤岗 岭 地铁站 晚上 工地 施工 扰民,A市,"工地严重,（副词：）"
A市潇楚南路由南往北右拐上相府路大桥红灯设置不合理,A市潇楚南路由南往北右拐上相府路大桥红灯设置不合理,市潇楚 南路 由南往 北右 拐 相府 路 大桥 红灯 设置 不合理,A市,"设置红灯,（副词：）"
我在A市的养老保险半年一交，为什么没有购房资格？,我在A市的养老保险半年一交为什么没有购房资格,市 养老保险 半年 一交 购房 资格,A市,"我没有资格,（副词：在）"
A市润万滨江天著毛坯房有严重质量问题,A市润万滨江天著毛坯房有严重质量问题,市润 万 滨江 天著 毛坯房 质量,A市,"毛坯房有问题,（副词：）"
A市万润滨江天著毛坯房有严重质量问题,A市万润滨江天著毛坯房有严重质量问题,市万润 滨江 天著 毛坯房 质量,A市,"毛坯房有问题,（副词：）"
A市恒泰楚壹府销售忽悠购房者交5万签下认购合同书,A市恒泰楚壹府销售忽悠购房者交5万签下认购合同书,市恒泰楚 壹府 销售 忽悠 购房者 交 万 签下 认购 合同书,A市,"壹府销售合同书,（副词：）"
我在A市的养老保险半年一交，为什么没有购房资格？,我在A市的养老保险半年一交为什么没有购房资格,市 养老保险 半年 一交 购房 资格,A市,"我没有资格,（副词：在）"
老百姓不满意A市相关部门对“辉煌国际城二期问题”的回复,老百姓不满意A市相关部门对辉煌国际城二期问题的回复,老百姓 满意 市 相关 部门 辉煌 国际 城 二期 回复,A市,"老百姓满意回复,（副词：不）"
A市玖珑山名苑房屋有严重的质量问题,A市玖珑山名苑房屋有严重的质量问题,市玖珑 山名苑 房屋 质量,A市,"房屋有问题,（副词：）"
A市来自外省的地铁保安如何维权？,A市来自外省的地铁保安如何维权,市 外省 地铁 保安 维权,A市,"保安维权外省,（副词：如何）"
A市公安局A4区分局非法拘禁关押人,A市公安局A4区分局非法拘禁关押人,市 公安局 A4 区 分局 非法拘禁 关押,A市,"分局关押人,（副词：非法拘禁）"
A市原国安驾校欺骗行为可耻,A市原国安驾校欺骗行为可耻,市原 国安 驾校 欺骗 可耻,A市,"行为可耻,（副词：）"
A市天健城第三期凌晨2点还在施工，严重扰民,A市天健城第三期凌晨2点还在施工严重扰民,市天 健城 第三期 凌晨 点 施工 扰民,A市,"施工,（副词：点）"
再次反映A市金茂府一房二卖,再次反映A市金茂府一房二卖,市金茂府 一房 二卖,A市,"反映二卖,（副词：再次）"
建议增加A市145路公交车班次,建议增加A市145路公交车班次,建议 增加 市 145 路 公交车 班次,A市,"建议增加,（副词：）"
A市万科金域蓝湾商铺烟道装在住户窗口这种做法合理合法吗,A市万科金域蓝湾商铺烟道装在住户窗口这种做法合理合法吗,市 万科 金域 蓝湾 商铺 烟道 装在 住户 窗口 做法 合理合法,A市,"做法合理合法,（副词：）"
A市旭辉御府业主子女的配套入学资格呢？,A市旭辉御府业主子女的配套入学资格呢,市旭辉 御府 业主 子女 配套 入学 资格,A市,"配套资格,（副词：）"
请问A市万润滨江天著的全装修核价什么时候出来？,请问A市万润滨江天著的全装修核价什么时候出来,请问 市万润 滨江 天著 全 装修 核价,A市,"请问出来,（副词：全）"
在A市参公管理事业单位工作的公务员在改革中受到不公平待遇,在A市参公管理事业单位工作的公务员在改革中受到不公平待遇,市 参公 管理 事业单位 工作 公务员 在改革中 公平 待遇,A市,"公务员受到事业单位,（副词：在）"
A市地铁4号线运行车库东红方项目部钢筋班拖欠农民工工资！,A市地铁4号线运行车库东红方项目部钢筋班拖欠农民工工资,市 地铁 号线 运行 车库 东 红方 项目部 钢筋 班 拖欠 农民工 工资,A市,"班拖欠工资,（副词：）"
A市政府每天晚上施工打洞打孔，不让人睡觉,A市政府每天晚上施工打洞打孔不让人睡觉,市政府 每天晚上 施工 打洞 打孔 不让 睡觉,A市,"人睡觉,（副词：）"
A市金桥国际大市场有没有地铁规划？,A市金桥国际大市场有没有地铁规划,市金桥 国际 市场 有没有 地铁 规划,A市,"规划,（副词：）"
A市A1区路到西湖路至乡村小道有环境污染问题,A市A1区路到西湖路至乡村小道有环境污染问题,市 A1 区路 西湖路 乡村 小道 环境污染问题,A市,"A1区路到环境污染问题,（副词：至）"
请A市公共资源交易中心联合纪委严厉查处类似评标委员会,请A市公共资源交易中心联合纪委严厉查处类似评标委员会,请 市 公共资源 交易中心 联合 纪委 严厉查处 类似 评标 委员会,A市,"请联合,（副词：）"
A市长郡楚府中学强制学生周六补课,A市长郡楚府中学强制学生周六补课,市长 郡 楚府 中学 强制 学生 周六 补课,A市,"学生补课,（副词：周六）"
A市黄兴北路通车两年多了，还有拆迁补偿金不到位的情况,A市黄兴北路通车两年多了还有拆迁补偿金不到位的情况,市 黄兴 北路 通车 两年 拆迁 补偿金 到位 情况,A市,"北路通车情况,（副词：两年）"
A市曙光南路（新建东路至南二环段）能不能增加隔离栏杆,A市曙光南路新建东路至南二环段能不能增加隔离栏杆,市 曙光 南路 新建 东路 南二环 段 增加 隔离 栏杆,A市,"段增加栏杆,（副词：能）"
A市银杏嘉园9栋的4台电梯故障频发！,A市银杏嘉园9栋的4台电梯故障频发,市 银杏 嘉园 栋 台 电梯 故障 频发,A市,"故障频发,（副词：）"
建议A市东二环晚报高架下桥段增加电子回拍监控,建议A市东二环晚报高架下桥段增加电子回拍监控,建议 市 东二环 晚报 高架 桥段 增加 电子 回拍 监控,A市,"桥段建议增加,（副词：）"
建议政府取谛A市内所有经营性麻将馆,建议政府取谛A市内所有经营性麻将馆,建议 政府 取谛 市内 经营性 麻将馆,A市,"政府建议取谛,（副词：）"
A市健萌私教馆无视会员权益，未经通知更改会员服务,A市健萌私教馆无视会员权益未经通知更改会员服务,市健萌 私教馆 无视 会员 权益 未经 通知 更改 会员 服务,A市,"私教馆无视权益,（副词：未经）"
A市美联嘉园物业私下变卖产权不明的地下车库,A市美联嘉园物业私下变卖产权不明的地下车库,市美 联嘉园 物业 私下 变卖 产权 不明 地下 车库,A市,"物业变卖车库,（副词：私下）"
购买A市“信享汇”商位钱款未退，血本无归,购买A市信享汇商位钱款未退血本无归,购买 市信 享汇 商位 钱款 未退 血本无归,A市,"购买A市,（副词：）"
A市燃星奥体健身房非法诈骗集资跑路,A市燃星奥体健身房非法诈骗集资跑路,市燃星 奥体 健身房 非法 诈骗 集资 跑 路,A市,"健身房诈骗路,（副词：非法）"
A市东山湾路什么时候修？,A市东山湾路什么时候修,市 东山 湾 路 修,A市,"修,（副词：时候）"
A市光蓝雍景阁2栋电梯经常坏,A市光蓝雍景阁2栋电梯经常坏,市光 蓝雍景阁 栋 电梯 坏,A市,"光蓝雍景阁,（副词：经常）"
A市公交车为什么不能用支付宝乘车码,A市公交车为什么不能用支付宝乘车码,市 公交车 支付宝 乘车 码,A市,"公交车不能码,（副词：为什么）"
A市千江锦园小区业主等了10年了，还没收房,A市千江锦园小区业主等了10年了还没收房,市千江锦园 小区业主 10 年 没收 房,A市,"小区业主等房,（副词：还）"
西地省银保监局拒不查处A市农商行的系统漏洞,西地省银保监局拒不查处A市农商行的系统漏洞,西地省 银 保监局 拒 查处 市农 商行 系统漏洞,A市,"保监局拒商行,（副词：不）"
A市高新区金南家园三期工地频繁通宵施工，噪音严重扰民,A市高新区金南家园三期工地频繁通宵施工噪音严重扰民,市 高新区 金南 家园 三期 工地 频繁 通宵 施工 噪音 扰民,A市,"工地扰民,（副词：）"
A市桂花坪失地农民的益利不容侵犯,A市桂花坪失地农民的益利不容侵犯,市 桂花 坪 失地农民 益利 不容 侵犯,A市,"益利不容侵犯,（副词：）"
A市北二环与中青路交界处有人倾倒渣土将耕地填埋,A市北二环与中青路交界处有人倾倒渣土将耕地填埋,市 北二环 中青路 交界处 有人 倾倒 渣土 耕地 填埋,A市,"交界处倾倒渣土,（副词：将）"
A市理工大学为迎接领导检查，严重影响学生生活,A市理工大学为迎接领导检查严重影响学生生活,市 理工大学 迎接 领导 检查 影响 学生 生活,A市,"理工大学为检查,（副词：严重）"
A市晟福兴汝金城二期涉嫌虚假宣传,A市晟福兴汝金城二期涉嫌虚假宣传,市晟 福兴 金城 二期 涉嫌 虚假 宣传,A市,"A市晟宣传,（副词：二期）"
